reviewAt,code,nickname,comment,avgScore,helpfulCount
2020.08.09,70213,jum**," 냄새가 살짝 났지만 편하고 좋았어요!
 직원분들이 엄청 친절해서 잘 쉬다갑니다",5.0,0
2020.07.25,70213,ekq**,조식이 맛있어서 놀랐습니다...! 시티뷰도 최고였구요! 또 가고 싶어요!,5.0,0
2020.07.19,70213,qks**,방음도 잘 되고 물도 잘 나와요!호캉스 잘하고 왔어요!,5.0,0
2020.07.15,70213,gyp**,직원들이 매우 친절했으며 방 정리정돈 상태도 아주 깔끔했다,4.8,0
2020.07.15,70213,new**,"치ㅁ구 패드만 덮어놓은 것 같아 이불을 덮진
않았습니다 ",5.0,0
2020.07.14,70213,f40**,조식이 맛이 괜찮고 숙소 내부 시설도 잘 갖추어져 있었어요,4.5,0
2020.07.06,70213,hss**,"시설도 전반적으로 깨끗하고 와인오프너,와인잔도 빌려주시고.. 좋았습니다.",5.0,0
2020.06.29,70213,gyw**,자ㄹ 잤습니다 침구에 뭐가 묻어있던것 빼곤 다 좋았어요,4.5,0
2020.06.02,70213,yij**,"가격대비 기대보다 훌륭!
조식 패키지였는데 괜찮았어요 :)",5.0,0
2020.04.26,70213,lsy**,위치도 너무 좋고 깔끔해서 잘 잤습니당 뷰도 너무 좋아요!,4.8,0
2020.04.26,70213,dpd**,편하게 잘쉬고가요. 다만 저녁뷔페 음식이 너무 안채워지네요 ㅠ,4.5,0
2020.04.06,70213,luv**,조식도 괜찮았고 방컨디션도 괜찮았어요! 무엇보다 직원분들 친절하셔서 좋았습니다! ,5.0,0
2020.04.06,70213,chj**,"직원분이 굉장히 친절했어요
그래서 다른 지적사항이 묻혔어요",4.5,0
2020.04.04,70213,cht**,여닫이문의 충격음을 완화시키면  더 즐거운 스테이가  될것 같습니다.,5.0,0
2020.03.13,70213,kyw**,"다 좋았습니다.
방음이 쪼금만 더 잘되었으면 좋겠습니다",4.8,0
2020.03.03,70213,myc**,침구가 좋아요 퀸사이즈고 실내인테리어는 딱 비즈니스호텔잊니다,4.8,0
2020.03.02,70213,cho**,신라스테이의 이름을 믿고 처음 이용해봤는데 다 만족합니다.,5.0,0
2020.02.24,70213,cjs**,예약자 이름에 오류가있어 치크인이 조금 더뎌지긴랬지만 전체적으로 만족했습니다.,5.0,0
2020.02.12,70213,iam**,"호텔시설, 직원 모두 친절했습니다 다음 기회에도 다시  이용하고 싶습니다 ",5.0,0
2020.02.09,70213,hw0**,시설은 깨끗하고 좋습니다. 위치가 지하철역에서 다 떨어져있는것이 조금 아쉽습니다.,4.5,0
2020.02.08,70213,jsy**,처음 방에서 냄새가 나서 룸체인지 해주셨어요. 친절하셨어요,5.0,0
2020.02.03,70213,ehr**,지하철서 약간 걸어야하지만 버스론가기 쉽고 인근에 밥 먹을곳도 많고 좋네요,4.8,0
2020.01.11,70213,msl**,모든 시설 깨꿋하고 주변 먹거리도 좋았습니다. 특히 호텔 조식 만족입니다!,4.8,0
2020.01.11,70213,gka**,"부모님이 이용하셨는데
조식이랑 침구에 만족하셨어요
덕분에 효도했습니다^^",4.5,0
2020.01.04,70213,qsx**,______정말 깔끔하고 괜찮습니다  방음도 잘 되어있고 편히 쉬다가 출근했습니다 ,5.0,0
2019.12.24,70213,woo**,"언제나 기본은 하는 호텔 입니다.
근데 방이 좀 추워요ㅠ",4.5,0
2019.12.11,70213,jyy**,매번 가는데라 익숙하기도한데 갈때마다 불편함 없이 잘있디옵니다,5.0,0
2019.11.29,70213,ale**,전체적으로 깔끔한 느낌입니다. 옆이 공사중이라 주말은 그래도 괜찮은듯하네요,5.0,0
2019.11.12,70213,dud**,직원분들이 친절해서 너무 감사합니다 잘 쉬다가 갑니다!,4.8,0
2019.11.10,70213,yas**,"외풍이 쎄서  바람이 창문서 숭숭숭~~좀 마니 추웠어요ㅜㅜ
나머진 만족입니다",4.5,0
2019.11.08,70213,ycp**,"깨끗하고  친절했습니다
역삼동이라 일보는데 접근성이 좋아서  만족했습니다",5.0,0
2019.09.30,70213,sun**,신스... 생각했던 이미지보다 직원들이 훨씬 프로페셔널했음 감동받음,5.0,0
2019.09.24,70213,ime**,"위치, 서비스 모두 만족스러운 수준. 특히 주차가 아주 여유로워 좋습니다",4.8,0
2019.08.25,70213,khw**,신라스테이는 역시 침구죠 눕자마자 꿀잠! 근데 침대옆에 콘센트 하나 넘 슬뻐용,5.0,0
2019.08.20,70213,kjw**,칄장갈때마다 가는호텔이라 언제가도 깨끗하고 침구도 좋고 전 완전 좋습니다,5.0,0
2019.08.19,70213,bes**,너무 좋았습니다. 시설도 좋고 조식도 좋고. 다음에 또 방문하겠습니다,5.0,0
2019.08.13,70213,ssa**,"진짜 꿀잠, 힐링 여행이었습니다.
조식도 좋았구용! 담에 또 가고 싶어요.",5.0,0
2019.08.13,70213,jin**,방도 너무 좋고 특히 조식이 맛있었어요! 역삼에 갈 일이 있다면 또 방문 의향 있습니당!,5.0,0
2019.06.13,70213,jih**,깔끔하고 좋아요 대신에 방에 의자가 하나인점은 불편했어요,5.0,0
2019.05.25,70213,hun**,"깔끔하고 세심했어요.
맥주한잔 할 테이블이 없던게 좀 아쉽",4.8,0
2019.05.21,70213,myp**,"홈바에 물만 있어 당황했다.
욕실유리문이 좁아 물이 밖으로 튄다.",5.0,0
2019.04.25,70213,jiy**,잠도 너무 잘오고 직원분들도 친절하시고 좋으셨어요~나중에 또 오려구요,5.0,0
2019.04.08,70213,lin**,대로쪽에있다보니아침부터자동차소리가들리긴하나..신라스테이만의깨끗함과편안함이있어만족합니다,5.0,0
2019.04.07,70213,chi**,도로뷰 숙소는 차량소음으로 원치않게 일찍 일어날수 있으니 참고하세요.,5.0,0
2019.03.21,70213,pjd**,"침구가 깨끗했고 전반적으로 좋았어요.  ㄷ
또 이용할거예요~",5.0,0
2019.03.05,70213,jis**,"신라스테이 ... 말하지 않아도 알아요. 
모든것이 좋아요",5.0,0
2019.03.02,70213,017**,침구도 깨끗하고 다 좋은데 난방이 좀 추워요...그래도 전반적으로 아주 쾌적합니다!,4.5,0
2019.02.20,70213,kjj**,좋습니다  체크아웃할때 딱 당해서 나오시면 엘베가 많이 막히니 그것만 유의하세요!,5.0,0
2019.02.15,70213,jan**,너무 좋았어용 ㅋ 직원들도 친절하고 근데 설날이라 조식 줄이 너무길어서 못먹었어용,5.0,0
2019.01.20,70213,do0**,깨끗하고 좋았어요. 주변에 먹을거리도 많아서 가끔 쉴 때 찾아가는 곳 입니다!!,4.5,0
2019.01.03,70213,nad**,접근성이 좋고 코엑스 근처에서 하는 불꽃놀이도 볼 수 있었습니다,4.5,0
2018.12.29,70213,che**,좋아요 미닫이 문을 닫으면 샤워하는 여자친구를 볼수 있어서 좋았어요,5.0,0
2018.12.17,70213,thi**,"잠이 잘온다. 잘잤다. 피곤했나? 침대가 좋았나?
암튼 좋았음. 친절 깔끔!",5.0,0
2018.12.12,70213,jis**,우ㅣ치. 시설.  모든게 좋았습니다. 침대가 어디 껀지 궁금하네요 ㅎ,5.0,0
2018.11.27,70213,wim**,헐리우드 타입배드로 변경도 해줘서 편안하게 잘 쉬었습니다,5.0,0
2018.10.07,70213,nar**,"침구가 푹신하구 조식도 가격대비 좋았습니다.
또 방문할 예정입니다^^",4.5,0
2018.10.01,70213,col**,깨끗하고 쾌적한 방에서 즐거운 시간 보냈습니다. 감사합니다^^,5.0,0
2018.09.29,70213,hug**,"시설이 깔끔하고 분위기도 좋고
다시 간다면 이곳으로 하겠습니다.",5.0,0
2018.09.28,70213,ljh**,"프로모션인형,방컨디션등 너무좋앗어요.다음에또 갈예정입니다.",4.8,0
2018.09.27,70213,kim**,"다좋았습니다.
한가지 부탁드리자면 환기를 잘해주셧으면 합니다.",5.0,0
2018.09.20,70213,san**,"가성비는 정말 좋아요
침구류가 특히 좋습니다 편안하게 잘잤어요",4.5,0
2018.09.17,70213,wee**,시설은 좋은데 IPTV가 안되는게 단점 ㅜ 요즘 시대에,4.8,0
2018.09.16,70213,xer**,"체크아웃 시간에 엘라베이터 타면 속터져요
엘레이베이터 교육이 필요함ㅎㅎ",5.0,0
2018.09.11,70213,hwa**,"룸 업그레이드 감사합니다.
시설 디테일이 꼼꼼한게 느껴졌어요",5.0,0
2018.06.27,70213,ili**,"침대 이불 베개 다 편하고 좋았어요. 가운, 실내화 등 어메니티도 좋았어요~~~",5.0,0
2018.06.13,70213,tor**,너무 깨끗하고좋아요 다만 샤워기 수압이 낮긴햇어요! 이거빼고대만족,4.8,0
2018.06.04,70213,yel**,"다 좋았는데 이중창이 아니라 소음은 있었어요~
조식은 평균이상은 되는것 같네요~",5.0,0
2018.06.02,70213,jye**,자주 이용하는 곳이에요. 저렴하게 이용했네요. 좋습니당,5.0,0
2018.03.10,70213,dlc**,"위치도 좋고 방도 깔끔해요
입실 시에 욕조 유무를 선택할 수 있었습니다",5.0,0
2018.02.15,70213,are**,샤워가운이 오래된건지 사용감이 심해서 구멍이 났네요ㅜㅜ그거빼곤 좋았어요,4.5,0
2018.01.09,70213,b2t**,"수건은좀 그렇네요. 좀더 고급진 수건이였으면하네요.
전망은 맘에들었어요",5.0,0
2018.01.08,70213,tls**,겨울밤 따뜻하고 편하게 자고갑니다 조식이 깔끔하고 좋네요,5.0,0
2018.01.05,70213,mim**,"침구가 포근해서 좋았어영~
뷰도 너무 좋았고영~
다음에도 다시가고 싶어영~",5.0,0
2017.12.06,70213,own**,전체적으로 다 깨끗했지만 화장실에 환풍구랑 샤워시설이 좀 더러웠어요.,5.0,0
2017.11.09,70213,yoo**,와인 잔 정도는 구비 해두면 좋을것 같다는 생각이 들었어요. 그외에는 만족 입니다!,4.8,0
2017.10.30,70213,spr**,부모님께서 숙박하셨는데 전체적으로 깔끔하고 특히 침구가 아주 마음에 드셨다고 해요.,4.8,0
2017.09.11,70213,ryu**,침구및침대 깔끔했구요. 전체적으로 클린한 컨디션의 룸였내요,4.5,0
2017.08.28,70213,jun**,어머니 생신에 선물해드렸습니다.! 분위기도 좋고 서비스 또한 훌륭했습니다. ,5.0,0
2017.07.07,70213,whg**,"침구도 뽀송뽀송 깨끗하고, 전체적으로 아주 쾌적했어요! ",5.0,0
2017.05.09,70213,bor**,좋았는데 계속 큰 진동소리가 났어요... 민감한 편도 아닌데 너무 시끄러웠어요,4.5,0
2017.05.05,70213,yee**,"다른건모르겠는데 객실이 좋았어요
좁았지만 그래도 깔끔했음",4.5,0
2017.05.04,70213,nyo**,조식도 적당하고 침구도 좋고 전반적으로 매우 만족스러웠습니다,4.8,0
2017.04.23,70213,soy**,비즈니스호텔 답게 필요한 모든게 룸에 컴펙트하게 준비되어있고 깔끔해요,4.5,0
2017.04.17,70213,dlw**,침구가 편해서 잠이 잘옵니다ㅋㅋㅋ다음날 일어나믄 천국에 잠잔 기분이 들어요ㅋ,4.5,0
2017.04.04,70213,gia**,"작은공간을 군더더기없이 깔끔하게 만들었어요
침대,바닥마루 모두 맘에들어요",5.0,0
2017.02.10,70213,yoo**,아주 좋았어요 3박했는 데 재정비도 잘해주시고 바닥에 먼지덩어리들만 아니었음 100프로임,4.8,0
2017.01.09,70213,nuc**,"방 사이즈가 생각보단 작았지만, 전체적으로 심플한 인테리어에 좋았습니다 ",5.0,0
2023.07.03,70213,wgd**,깨끗하고 침대가 좋았어요,4.3,0
2023.05.02,70213,ues**,정말 불친절한 동네 싸구려 호텔..직원 교육이 진짜 필요한 곳 같음,4.0,1
2022.09.14,70213,eve**,"침구는 폭신하니 넘 좋아요 직원분도 친절하시고
가성비 최고입니당",4.0,0
2022.08.23,70213,bae**,"접근성 짱 ..
노트북 사용이 필요했는데
비즈니스 코너에서 잘 사용했어요!",4.0,0
2022.07.31,70213,wjs**,조식이 너무 맛없고 먹을게 없음. 배가 안차는것들만 있음. 냉동만두. 냉동빵 등. 볶음밥도 없고.,3.0,0
2022.07.24,70213,kuj**,침구가 좋습니다 배게 두개는 입구쪽 옷장에 더 있어요~ 주변에 식사할곳도 많아요,4.0,0
2022.07.04,70213,rud**,괜찮았어요 . 조금더 깨끗해지면 좋겠다 라는 생각을 했어요 . 예전보다는 아니더라구오,4.0,0
2022.05.13,70213,pia**,"신라스테이중 여기가 그냥그러네요
주차는좋아요
조식도 짜고 죽은 덩어리가있고 
바로 한 음식이 아니에요
가성비 별로에요",3.0,0
2022.02.09,70213,gyu**,낡았어요 벽에 몰딩 다 뜯어지고 등도 다 뜯어지고… 출장으로 하루묵기는 딱이에요,4.0,0
2022.01.30,70213,wel**,위치나 시설은 당연히 좋은 편 직원이 부족해서인지 채크인이 오래걸려서 아쉬움,4.0,0
2022.01.17,70213,040**,"역시 침구가  넘무 편해 푹 쉴 수 있었어요
기회되면  꼭 재방문이죠",4.0,0
2021.10.04,70213,man**,"근처에 볼일이있어 급하게 예약했는데 잘 보냈습니다
슬라이딩 도어가 뻑뻑해서 힘들어요",4.3,0
2021.09.06,70213,bud**,편하고 푹신하게 잘 잤어요. 욕실용품 아베다 좋았습니다,4.3,0
2021.09.01,70213,tdc**,오래되어서 그런지 의자같은 곳에서 삐그덕 거리는 소리가 많이 났어요,4.0,0
2021.08.09,70213,cel**,"조식이 부담 없이 맛있었어요
아이폰 충전기 재고가 많이 없는 건 아쉬웠어요ㅠㅠ",4.3,0
2021.07.23,70213,min**,침구 깨끗하고 방 컨디션 좋았어요. 화장실에 배스텁도 있고 꽤 좋았습니다,4.3,0
2021.05.09,70213,dy2**,부모님 보내드렸는데 친절하고 조식도 맛있구 좋았다하셨어용,4.0,0
2021.04.05,70213,cys**,자주 애용하는데 오늘은 트윈베드였는데 더블베드보단 별로였어요!,4.3,0
2021.03.16,70213,shi**,"접근성도 좋고
청결하고 
서비스도 좋았어요 ㅎ.ㅎ 
또 호캉스하러 갈거에요",4.0,0
2021.02.14,70213,moo**,룸 바닥과 화장실 샤워부스 바닥을 좀 깨끗하게 청소해야 할 것 같아요.. 그 부분 빼고는 대체적으로 만족스러웠습니다!,3.3,0
2021.02.12,70213,cjy**,깨끗하긴 했지만 침구류가 오래되었는지 살짝 찢어져있고 화장실에 머리카락이 있었어요 ,4.3,0
2021.02.01,70213,lkd**,"드라이기가 따뜻한바람이 안나오고 자꾸 접혀요 
방은 하루종일 30도로 해놔도 온도가 안올라거고 추워요",3.3,0
2021.01.31,70213,cys**,침구가 찢어진건 아쉬웠어요! 하지만 종이컵있는게 아주조아써용,4.3,0
2021.01.22,70213,ang**, 침구도 깨끗하고 룸 컨디션도 좋고 덕분에 푹 잘 쉬었습니다.,4.0,0
2021.01.12,70213,zmf**, 합리적인 가격에 레이트 체크아웃과 중식까지 잘 놀고가요~,4.0,0
2021.01.02,70213,be_**,침대 틀이나 몇군데에 먼지가 살짝 있었던것 말고는 전체적으로 깔끔하고 편했어요,4.0,0
2020.11.09,70213,고객님,조식식사 굿입니다. 베개를 높게해서 숙박하는분위해 추가 비치를 요청합니다.,4.0,0
2020.11.07,70213,dus**, 침구는 깨끗했지만 방이 너무 좁고 문 바로 옆에 욕실이 있어서 불안했어요,4.3,0
2020.10.23,70213,son**,"조식 굿
깨끗하고 좋았어용
지하철에서 멀어서 ㅠㅠ좀 그랬지만",4.3,0
2020.10.17,70213,sus**,"가끔 호캉스로 이용하기 괜찮은곳 같아요
직원분들도 친철하세요!",4.0,0
2020.10.12,70213,chl**," 신라스테이 침대는 항상 푹신하고 좋은것같아요ㅠㅠ
잘 쉬다가 갑니다!",4.3,0
2020.09.29,70213,ssh**,깨끗하구요 주차비는 오천워있지만 그래도 괜찮아요~뷰도 나름 괜찮구요 잘쉬다 갑니다,4.0,0
2020.09.16,70213,gra**,침구 진짜 좋았고 잘 잤어요 혼자만의 시간을 잘 보내고 왔습니당,4.3,0
2020.08.25,70213,jih**,코로나때문에 다른 시설을 더 많이 즐겼으면 좋았을덴대 아쉬웠어요ㅜㅜ,4.3,0
2020.08.19,70213,hj_**,매트리스 너무 불편해서 자고 일어나서도 여전히 피곤했어요....,4.0,0
2020.08.11,70213,511**,"물이 너무 부드럽고 온천수 같은 느낌?
매트리스도 좋았어요~",4.0,0
2020.08.05,70213,kea**,비데가 고장났습니다.  장마라 그런지 습한기운이 심해서 인지 곰팡이 냄새가 많이 났습니다.,3.0,0
2020.07.21,70213,yas**,"오래된 호텔치고는 상태가 좋았습니다~
드라이기가 너무 약해요",4.0,0
2020.07.08,70213,mom**,새ㅇ수를 요청했는데 친절하게 추가로 가져다 주셔서 놀랐습니다. 안경쓰고 셔츠입으셨던 남자분 감사합니다.,3.0,0
2020.06.27,70213,ssg**,"객실이 작긴했지만 감안하고 예약한거라 좋았어요~
접근성 좋았어요!",4.3,0
2020.06.04,70213,seo**,아베다바디용품들있어좋아요침구도깨끗하고가구배치도편하고테이블컴작업하기편해요조식도굿~,4.0,0
2020.05.31,70213,hpo**,수압이 아쉽긴 했지만 객실이 너무 깨끗했습니다 잘 쉬다 갑니다,4.3,0
2020.05.14,70213,new**,바ㅇ음이 좀 안되는거 빼고 괜찮았어요. 주차 1대밖에 안됨,4.0,0
2020.04.05,70213,jae**,"깨끗한데다가 친절하고 좋았어요
가격도좋구요
다만 엘레베이터 키는 두개 주셨으면 싶었어요",4.0,0
2020.03.23,70213,jeu**,"침구도 좋고 방상태도 좋았습니다.
다음에도 또 이용하고 싶습니다.",4.3,0
2020.03.23,70213,kim**,위치가 좀 애매하긴 하나 좋았어요 깨끗하고 조용하고 친절하셨어요.,4.3,0
2020.02.13,70213,jyh**,"전반적으로 괜찮았고 청소 잘 되어있었는데,
문이 자꾸 덜컹거리는 면은 있네요.",4.3,0
2019.12.25,70213,wjd**,"나쁘지는 않았지만 그렇다고 좋지도 않았던것 같아요
객실의 청결도가 그렇게 깨끗하지도 않았구요",3.3,0
2019.10.09,70213,loa**,직원들도 친절하고  이용하는데 불편함이 없이 사용한것 같네요.,4.3,0
2019.09.23,70213,04d**,가성비 좋은 호텔이었습니다. 조식은 다소 아쉬웠습니다.,4.0,0
2019.09.19,70213,04d**,가성비 좋은 호텔이나 조식은 큰 기대는 안 하고 가는 게 좋을 것 같아요.,4.0,0
2019.06.06,70213,shi**,방음이 너무 안됬아요.. 다른사람이 자ㄱ꾸방문을열려고해서 무서웠으요..,4.0,0
2019.05.09,70213,379**,전체적으로 깨끗합니다. 침구도 화장실도 깨끗했어요 방이 작긴하지만 아늑하니 좋았습니다,4.0,0
2019.05.06,70213,for**,"벽지나 입구쪽 천장에 스크레치가 많네요  
숙박하는데는 큰문제 없었습니다 ",4.0,0
2019.04.13,70213,dan**,"시설 및 침구가 너무 좋았습니다. 
대신 방음이 조금 아쉬웠어요. 
그래도 만족합니다~",4.3,0
2019.04.03,70213,ghk**,"새벽에 복도에서 약간의 소란이 있었으나
그거 외에는 완벽했습니다.",4.3,0
2019.02.16,70213,tru**,"실내온도 조절기를 눌러는데도 
밤새 온도가 24를 넘지않아 엄청 추워서 고생했어요",4.0,0
2019.01.29,70213,o0j**,그냥 딱 생각한 대로 였어요. 근데 직원이 불친절했어여.....,4.3,0
2019.01.17,70213,f_s**,시설 조식 뷰 좋아요 근데 위치가 애매해요. 그거말곤 다 굿,4.0,0
2019.01.17,70213,daf**,지어진 시기에 비행 usb포트도 없고 충전기 대여도 없어서 불편햇습니다. 가격대비 감수할 정도라 큰 불만일정도는 아니엇습니다,3.3,0
2019.01.11,70213,201**,"하수구에서 악취가 너무심해서
머리가 아플정도였네요
참을수 없어 방을 바꿨지만
수리가 필요한방을 준다는건 불쾌함",3.0,0
2019.01.09,70213,moo**,깨끗한 호텔과 직원들의 친절함이 좋았습니다. 역시 신라호텔이 다르네요~~~^^,4.0,0
2018.10.29,70213,can**,잘 잤습니다 까운 좋았고 아베다 욕실제품들 괜찮구요 방이 조금 좁았습니다,4.0,0
2018.10.08,70213,hip**,"교통 편리한 위치
일층에 편의점과 베이커리 카페가 있어 좋았어요",4.0,0
2018.09.11,70213,mh4**,조식 깔끔하고좋았어요 셋팅하면서 피곤한듯한 표정과 정리하는 소리들이 약간신경쓰였습니다,4.0,0
2018.08.25,70213,nli**,"생각보다 좁았지만, 도로변에 위차한 것 치곤 소음도 거의 없고, 좋았습니다.",4.0,0
2018.08.15,70213,sj8**,"접근성이 좋아서 선택.
주위 식당도 많아서 손님대접하기도 편했습니다.",4.0,0
2018.06.25,70213,mol**,조회된 가격과 최종 결제 될 가격이 좀 차이가 납니다.,4.0,0
2018.06.13,70213,hcr**,"청소엄청 잘되어있어용 ㅎㅎ 소음도 적고 ,,
룸업글해주셔서 16층이였는데 굿굿!!",4.3,0
2018.05.23,70213,suz**,"침구좋음 전반적으로 깨끗했으나 
먼지뭉탱이가 발견됨... ",4.0,0
2018.04.08,70213,shy**,"깨끗하고 아담해서 실용적인 공간 같아요
주변에 늦게까지 먹을만한데도 있고요",4.0,0
2018.03.31,70213,spr**,침구가 깨끗하고 업그레이드까지 해주셔서 더욱 만족했던 숙박이었습니다^^,4.0,0
2018.02.17,70213,liv**,호텔 앞 전광판이 밤새 켜져 있어 불편했던 것을 제외하면 만족했음.,4.0,0
2018.02.17,70213,san**,"접근성은 매우 떨어지고
직원들 좀 불친절 말하는게 띠꺼웠음
시설은 그냥 보통인데 매우 좁고 침구는 갠찮음",3.0,0
2018.01.25,70213,myr**,"침구도푹신하고 몸풀고가니 좋았어요.  
조식이 맛있었어요!",4.0,0
2018.01.02,70213,cho**,"전체적으로 방음에 문제가 있어요 객실에 중문도 없고 욕실앞에서 옆방 tv 시청 소리가 들릴정도에요
다른거 침구류는 좋았습니다 ",3.3,0
2017.12.10,70213,xix**,"역과도 가깝고, 친철했다.
방도 깨끗.
다시 투숙할 용의가 있음",4.0,0
2017.11.26,70213,aos**,"수건,가운이 너무 오래된건지 심하게 낡아서 
너덜너덜했어요ㅡㅡ",4.0,0
2017.10.08,70213,int**,아침 9시에 청소한다고 벨누르는거 빼곤 대체로 만족. 방이 많이 작음. ,4.3,0
2017.09.10,70213,dla**,다른 신라스테이에 비해 방이 좀 좁았지만 적당히 깔끔한 느낌,4.3,0
2017.08.16,70213,haw**,"침구가 너무 좋았고 조식도 맛있었어요
군더더기 없는 비지니스호텔이였습니다.",4.3,0
2017.08.11,70213,myb**,"깔끔하고 쾌적한 느낌이 좋았고
책상이 있어서 일을 하기에도 좋았습니다",4.0,0
2017.08.09,70213,ens**,침구는 깨끗하고 좋았지만 화장실 물이 잘 빠지지않고 변기에서는 좀 냄새가 났습니다,4.0,0
2017.07.03,70213,esh**,침대가 푹신해요~ 다만 어메니티중 샴푸 컨드셔너가 ㅠㅠㅠㅠ 별로였어요 ,4.0,0
2017.05.13,70213,ama**,룸컨디션이 좋고 방음이 잘안된다고 들었는데  나쁘지않았고 전체적으로 만족했어요^^,4.3,0
2017.04.12,70213,nar**,"깨끗한 느낌이라 매번 방문하는데 

침구에 뭐가 두군데나 묻어있어서ㅜ 찝찝했어요",4.0,0
2017.03.23,70213,swr**,침구가 너무 맘에 들었어요 전체적으로 깨끗해서 좋았습니다,4.3,0
2017.03.04,70213,shi**,아주 깔끔하고 좋아요. 역시 호텔은 브랜드값을 고려해야 하네요,4.0,0
2017.02.06,70213,whi**,깔끔하고 좋았습니다. 다만 프론트 대응이... 지쳐 있는듯,4.3,0
2017.02.05,70213,jsm**,"커피포트에 쓰다 남은 물이 그대로 남아있어서 당황스러웠네요
프론트직원들의 서비스도 좀 기계적이고 차가운 느낌이 아쉬웠습니다",3.3,0
2017.01.31,70213,kim**,"방을 업그레이드 해준점은 감사하지만
몇몇 직원들은 서비스업의 자세가 아닙니다",4.3,0
2017.01.30,70213,ejf**,"시설은 약간 노후된 느낌, 침구는 깨끗하고 룸 온도는 따뜻했지만 건조함",4.0,0
2016.12.26,70213,yoo**,다른 모든것은 만족하나 좀 추웠고 타월이 좀 더러웠어요,4.0,0
2023.01.07,70213,jej**,전철에서 다소 먼거리였고 약13분정도 걸렸습니다 방은 괜찮은데 tv가 작았고 채널이 몇개 없어서 볼개 없어서 음악들음,2.5,0
2022.11.28,70213,sch**,후기때문에 걱정했는데 그냥저냥 잘 다녀왔습니다. 무난무난한거같아요,3.8,1
2022.09.29,70213,sin**,"체크인 시간이 너무 오래 걸리고
엘리베이터도 느려서
조금 불편했어요",3.8,0
2022.01.15,70213,pil**,침구가 깨끗하지 않고 오래되고 화장실 머리 뭉치가 바닥에 굴러다님,3.5,0
2021.06.17,70213,bei**,"시설이 노후되기 시작하였고, 샤워기가 고장날 것처럼 이상했습니다.",3.5,0
2021.04.25,70213,rla**,시ㄴ라 스테이 하면 침대.. 푹신해서 근심 없이 잘잤습니다. ,3.8,0
2020.12.31,70213,nyb**,방안 시설이 너무 낡았어요 냄새도 안좋구요. 침대옆 간이 소파는 삐거덕 삐거덕 엉망이구요. ,2.8,0
2020.11.28,70213,dad**,방크기 다 만족스러운데 침구가 오리털 너무 많이 빠져요 그것빼면 다 만족이요,3.8,0
2020.11.17,70213,roh**, 전체적으로 만족스러웠구요! 깨끗했습다 :) 잘 쉬었다 가요,3.8,0
2020.10.07,70213,ozm**,추석연휴내내 헬스장문닫앗는데 머무르면서 운동할수있어서 좋았어료,3.5,0
2020.09.08,70213,act**,샴푸보다 비누의 질이 더 좋아서 어제 저녁. 아침 모두 비누로 감았습니다..,3.8,0
2020.07.06,70213,har**,"너무 낡았어요. 조식 먹을게 별로였어요.
직원분들은 친절합니다.",3.5,0
2020.06.19,70213,umh**,오ㅏ인잔 와인오프너 수령하러 직접내려가는 번거로움 외에 다 좋음,3.5,0
2020.06.04,70213,hee**,호ㅏ장실에서 냄새가 조금 나긴하는데 그것빼곤 다좋앗어요,3.8,0
2020.06.02,70213,dal**, 전반적으로 깨끗하고 좋았습니다 가격도 합리적이였구요. 재방문의사도 있습니다~ ,3.8,0
2020.05.14,70213,rem**,"신라야 늘 기본은 하니까요
어느정도 노후된건ㄴ 감안하셔야해용",3.5,0
2020.05.04,70213,gpw**,"새벽에 갑자기 환풍기를 통해 담배냄새 유입
잠을 제대로 못 잤습니다",3.5,0
2020.04.02,70213,voo**, 방의 청결도는 역대급 최악이었습니다. 먼지가 아주그냥... 문도 잘 안열리게 만들어놔서 문마다 찌그러져있더라구요. ,2.3,0
2019.11.23,70213,nmr**,"창쪽으로 들리는 소음이 밤새도록 신경쓰여서 잠을 잘 못잠..
조식도 생각보다 별로였음..",3.5,0
