reviewAt,code,nickname,comment,avgScore,helpfulCount
2022.03.06,73846,ybh**,"주차는 중형차로 진입할시  너무 비좁아서 범퍼를 긁힐정도로 좁고..
만차가 되있는데도  직원이 아무런 정보도 안주고..저나해서 주차공간이업다고  얘기해서야 옆건물 주차장으로 안내해주었습니다..
처음 부터 주차공간이 헙소하고 위험하다는것을    안내 해줘야함에도  
어떤 정보도 업었습니다
 모텔도   이러지는  않습니다.!!!
객실은 천정  매입등이  2개 깜밖이고 ..새벽한시에
직원이  와서  손본후에야  잠을잘수 있었습니다
정말 최악의 호텔입니다
차가지고  절대가지마세요!!",2.5,0
2020.12.28,73846,alf**,지ㄱ원분들 친절 / 침구는 무슨 가루같은게 느껴져서 다 털고 잤어요 ㅜ ㅜ / 다음엔 씨티뷰 아닌 가든뷰 선택할래요 차소리가 시끄러움!,3.8,0
2020.12.06,73846,kei**,"33시간 스테이했는데, 2째날에 룸청소를 안해주셔서 아쉬웠어요.. 그래도 위치나 룸상태 등 저렴한 가격에 이용할 수 있어 좋았습니다. ",3.5,0
2020.04.21,73846,gas**,"처음 방문했을때 뷰가 좋아서 일주일만에 재방문했습니다
다 좋앗는데 마지막에 체크아웃하기전 
침대 옆 서랍을 열엇는데 여자 속옷과 스타킹이 있었습니다
체크인 할때 코로나때문에 설문조사하고 각서받아서
엄청 청결하게 관리하나 싶엇더니
룸은 뭐 그냥 대충 눈에 보이는데만 치웠는가봅니다
침대시트는 갈앗으려나 모르겠네
처음에 발견했으면 방을 바꿧을텐데
체크아웃할때 발견해서 좋은기억 완전 똥망했습니다
차라리 서랍을 열어보지 말걸
",2.8,0
2019.05.07,73846,eun**,위치 접근성 및 이정도 컨디션좋은 숙소가 주변에 흔치않아 자주 이용하는편인데요. 초창기에 투숙객들이 어색해해서 어설펐던 셀프체크인/아웃제가 익숙해진뒤로 서비스및 응대가 소홀해짐을 느낌니다. 융통성이 없어지니 센스도 없어지는것같고. 이럴꺼면 데스크직원은 왜 여러명씩 상주해있는걸까요? ,2.8,0
2018.09.02,73846,ina**,"방에서 핸드폰이 너무 안터져요. 전화도 끊기고, 인터넷(LTE)은 거의 안되다시피 하고, 심지어는 호텔 와이파이도 되다 안되다 하네요. 비즈니스 목적으로는 영 만족스럽지 않습니다. late checkout도 야박합니다.",2.5,0
2018.08.08,73846,a94**,"호텔방  바닥이  카펫이다보니 
먼지도많이  날라다니고 
자고일어나면  목이  너무아픕니당..
주차장  입구출구는..왠만한분들은  절대  못들어갈듯..ㅈ
휠  다 긁어요",3.5,0
2018.01.11,73846,kgo**,전반적으로 직원 CS 교육이 잘 되어있는 점에서 기분 좋게 잘 머물다가 갔습니다 정전되는 상황이 좀 당황스럽지만 빠른 대처에 감사합니다^^,3.5,0
2018.01.05,73846,son**,"욕실 용품이 호텔 가격대비 너무 부실합니다
타 호텔 대비 직원들이 친절하다고 느끼지 못하고 사람이 많은 일자였는 것을 고려하더라도 조금은 기분이 상하게 되었습니다",3.8,0
2017.12.27,73846,ari**,22만원 2인 룸 이용했는데 방은 6만원짜리 모텔방보다 못하네요. 방은 다닥다닥 사람은 엄청많아서 붐비는 시간에 3개짜리 엘리베이터 이용하려면 수십분은 기다려야합니다. 18층부터 걸어내려왔네요. 조식은 가격대비 그저그런 정도이고 여러모로 많은 실망을 했습니다.,2.5,0
2023.08.29,73846,woa**,완전좋아요 회사근처이기도하구요,5.0,0
2023.08.29,73846,200**,침대가 편안하고 깨끗했어용,5.0,0
2023.01.20,73846,smj**,침구도 너무 깨끗하고 조용해서 편안하게 쉬고 갑니다!!!직원분들도 친절하셔서 좋았어요!!다음에도 가고 싶네요!,5.0,0
2022.09.26,73846,sal**,가든뷰 객실을 이용했는데 선정릉이 한눈에 보여서 너무 좋았어요. 객실도 컨디션 좋고 특히 침수가 편해서 좋았습니다.,5.0,0
2022.08.09,73846,val**,두번째 방문인데 넘친절하셨고 슈페리어룸으로 업글해주셔서 너무 쾌적하고 좋은 호캉스였습니다!!😘😘,5.0,0
2022.06.06,73846,sin**,침구도 깨끗하고 방 컨디션 좋았어요. 풋스파도 할수있고 좋아요. 다만 화장실문이 조금 불편했어요,5.0,0
2022.03.14,73846,aea**,"다른거 다 빼고 주차가 최악입니다.
기껏 1층 로비앞에 자리가 있어 주차했더니
미리 전화로 예약한 사람만 주차가 가능하다며 
자리를 이동해달라고 한게 밤 11시넘어서입니다.
부탁이 아니라 통보형식이어서 매우 기분이 안좋았습니다. 통보는 아니지만 무조건 옮겨줘야한다고 했는데 그게 통보 아닌가요 ㅎㅎ
옆건물 주차권 줘서 옮겨서 주차하긴 했지만
밤 11시 넘어 주차 옮겨달란 전화는 불쾌하더군요.
대중교통이용하실 분만 추천합니다.",2.0,0
2022.02.22,73846,sey**,직원분들도 친절하고 화장실이며 방 전체가 깔끔하고 깨끗해서 만족스러운 하루를 보냈습니다 ㅎㅎ,5.0,0
2022.02.19,73846,agn**,"도로변이라 차소리는 조금 나지만
시설은 가격대비 정말 좋습니다
비지니스호텔이지만
1급 호텔 같습니다",5.0,1
2022.01.09,73846,shg**,"직원들도 친절하고 객실도 원하는 고층에 선정릉뷰로 배정해줘서 좋았어요!
그런데 엘리베이터가 너무 안와서 불편했어요 ㅠㅠ",4.5,0
2022.01.04,73846,suc**,자꾸 다른 방 담배 냄새랑 음식 냄새가 넘어왔어요 ㅜㅡㅜ 그거 말고는 뷰도 시설도 다 좋았습니다,5.0,0
2021.12.31,73846,azd**,"직원분들이 친절하셔서 편한 마음에 이용할 수 있었구요, 뷰도 정말 좋더라고요.
티비가 좀 더 크면 좋겠어요
암튼 다 좋습니다",5.0,0
2021.12.05,73846,bla**,"룸 컨디션도 좋았고 전반적으로 다 만족스러웠으나
주차장 진출입로가 매우 좁고 주차가능대수가 적어서 좀 불편했습니다ㅎ",5.0,0
2021.11.15,73846,nai**,"전체적인 시설도 좋고 청결도 아주 좋았어요!
업무차 혼자 투숙했는데 여자 혼자 자기에도 안전했어요^^",4.8,1
2021.09.08,73846,joo**,"직원분들께서 아주친절하셨고
모든 부분이 깨끗하게 잘 관리되어있었습니다!
와이파이가 문제가 있었는데
전반적으로 괜찮았습니다",5.0,0
2021.07.01,73846,qlr**,"직원분들 친절하시고 방도 너무 좋았어요 ㅎ
역 근처라 다니기도 좋았고 
다음에 또 기회가 된다면 또 갈거같아요",4.8,0
2021.06.16,73846,jun**,L7는 갈때마다 직원분들도 친절하고 만족감이 높은데 베개가 너무 낮고 쿠션감이 없는게 흠이라면 흠 같습니다 ㅜㅜ,5.0,0
2021.03.21,73846,osk**,"자주 이용하는 호텔입니당 
너무 깨끗하고 룸도 좋고 직원분들도 친절해서 기분좋게 머물다 가용",5.0,0
2021.03.19,73846,jas**,체크인 시간보다 빨리 도착했는데 방이 미리 준비되어 있어 저금 일찍 체크인 할 수 있어서 좋았습니다 ,4.8,0
2021.02.14,73846,tos**,10번출구에서 걸어서 4분정도. 주변에 스타벅스 있고 지하1층에 밤12시까지 하는 편의점 있음.,5.0,0
2020.12.31,73846,rla**,깨끗했어요~ 직원분들도 친절하셨고 가든뷰 예약했는데 앙상해서 아쉽긴 하지만 야경도 좋았어요,5.0,0
2020.12.17,73846,kun**,"지ㄱ원분들이 친절하고 조용하고 좋았습니다
코로나때문에 부대시설을 이용하지못한게 매우 아쉽지만 또 방문할 의향이 있습니다 ㅎㅎ",5.0,0
2020.12.07,73846,shi**, 주차장 들어가고 나가기 엄청 힘들어요... 통로도 좁고 공간도 뱔로 없고 ㅠ 다른건 다 좋습니다^^,5.0,0
2020.11.11,73846,pes**,"위치가 좋았고, 프론트 직원분들이 정말 친절하게 잘 대해주셨습니다. 잘 쉬다왔어요. 고맙습니다",5.0,0
2020.11.01,73846,yej**,사람이 많아서 그런지 체크인 할때 19분 기다리게 만들고 또 엘리베이터는 얼마나 느린건지 한번 타려고 하면 긴 줄을 기다려야했습니다. 욕실 세면대에는 얼룩이 남아있었고 좋다고 느낀게 많지는 않네요.,2.0,0
2020.10.31,73846,jin**,"기대이상. 침구가 너무 편해서 오랜만에 잘잔듯해요
잠자리 예민하신분들은 고민하지마시고 여기에요!!",5.0,0
2020.09.18,73846,cle**,ㅋㅋ샤워기가 안되는건줄알았더니 그게아니라 벽쪽으로 밀었어야되더라구요ㅋㅋ 주변에먹을곳두많구좋았어요,5.0,0
2020.07.14,73846,alw**,"체크인 시 응대 직원 매우 친절했고, 룸 컨디션 좋았습니다. 욕조있는 슈페리어룸 좋네요 :)",5.0,0
2020.07.12,73846,yig**,주차장 빼고는 좋은 호텔입니다. 소형차 아님 가져가지 마세요. 주차 이중으로 해놓고 지하주차장서 차 돌리다가 하루다 갈뻔,5.0,0
2020.06.04,73846,han**,슈페리어로 무료 업그레이드 해주셔서 좋은 가격에 깔끔하고 경치좋은 곳에서 잘 머물다 갑니다 :),4.8,0
2020.05.27,73846,pre**,"전반적으로 룸 컨디션은 좋았어요
근데 주차장 들어가는길이 넘 좁아서 좀 불편하드라구요
그것만빼면 최고였습니다",5.0,0
2020.05.25,73846,dnt**," 직원분들도 너무 친절하고 , 청결상태도 
매우 좋네요 :) 30시간 숙박이였는데 침구도
너무 편안하네요 ",4.8,0
2020.05.09,73846,mud**,처음 입실했을 때 세면대에 머리카락 많이 떨어져있던 것 빼고 좋았어요. 선릉 뷰가 예뻐요.,4.5,0
2020.05.02,73846,pin**," 친구랑 함께 갔는데 너무 좋았습니다
정수기가 복도에 있어 얼음도 사용가능하고 좋았고 깨끗한시설에 만족했습니다!",5.0,0
2020.04.29,73846,dro**,"깔끔한 시설, 침구 그리고 무엇보다도 좋은 뷰가 인상적이었습니다
화장실이 조금 작은편이었지만 크게 불편한 정도는 아니었습니다",5.0,0
2020.04.24,73846,sol**,배드와 욕실 만족스러워요.특히 조식도 재료가 신선해서 생각보다 많이 먹었음.대체적으로 Good !,5.0,0
2020.04.21,73846,tr9**,깨끗하고 어매니티로 나온 샤워용품 향이 좋았어요 밑에 편의점도 있고 좀 나가면 롯데슈퍼도 있네요 조식도 진짜 맛있었어요,4.8,0
2020.04.12,73846,0oo**,"30시간 패키지로 너무 편하게 다녀왔어요
운동을 못해서 조금 아쉬웠지만ㅠ 
그래도 깨끗하고 조용하고 따뜻했어요!",5.0,0
2020.04.11,73846,kim**,"호텔 자체가 너무 예뻤고, 방도 심플하고 깔끔해서 좋았습니다. 직원분들도 다들 친절하셨고 전체적으로 아주 마음에 들었습니다.",5.0,0
2020.03.31,73846,vv1**,"수페리어 객실로 고층 받았는데 뷰가 정말 좋았습니다 !!
객실도 깔끔하고 다음에 또 이용할 것 같네요 ㅎㅎ",4.5,0
2020.03.24,73846,o0o**,"저ㄴ반적으로 깔끔하고 직원분들도 친절하셨습니다
혼자 서울간건 처음이었는데 덕분에 편히쉬다왔습니디 감사합니다 ^^",5.0,0
2020.02.01,73846,ver**,"호텔 내부 전반적으로 깔끔하고 좋았습니다!
딱 하나 아쉬운건, 주차장 내려가고 올라갈때 좁아서 조심해야 할것 같아요.",5.0,0
2020.01.15,73846,ann**,직원분들이 친절해서 좋았어요^^요청사항도 잘 들어주시구요ㅎㅎ뷰도 너무 좋았구 또 가고싶어요!,5.0,0
2019.12.30,73846,ran**,아이가 감기때문에 고생해서 가습기 부탁드렸더니 흔쾌히 가져다 주시고 넘 친절하게 대해주셔서...감사했어요,5.0,0
2019.12.13,73846,pan**,기대안하고 갔던 곳인데 나름 깔끔하고 직원분들도 친절하셔서 만족스러웠어요. 담에는 퀸스위트로 예매해서 가보려구요~,4.5,0
2019.10.10,73846,cla**,룸 컨디션도 너무 좋고 뷰도 나름 좋았습니다!  전체적으로 시설이 깔끔하고 잘 갖춰져 있어서 불편함 없이 지내다 왔네요!!,5.0,0
2019.08.19,73846,khb**,침구를 더럽혔는에도 바꿔주셔서 감사했어요. 친절한 직원분들 감사합니다. 다음에도 방문하고 싶어요,5.0,0
2019.07.28,73846,ats**,가족과 힘께 비오는데 고층에서 조용히 잘쉬다 갑니다 다들 주차장이 좁다는데 초보들은 좀 힘들지만 전 크게 문제없었어요,5.0,0
2018.12.12,73846,shh**,걍최고.. 배민에서 음식 시키고 와인사간다음에 와인잔좀 부탁해서 받아서 따라마셨더니 크으~~,5.0,0
2018.11.11,73846,fw1**,"시설이 쾌적하고 직원분들이 친절하고 요구사항도 바로 들어주시네요
조식에 누들류가 있었으면 더 좋겠네요",5.0,0
2018.09.06,73846,gol**,시설부분이라던가 뷰리던가 접근성부터 직원분들의 친절함까지 너무 좋았습니다 다음번에 또 이용하려구요,5.0,0
2018.08.28,73846,bir**,"침구가 포근하고, 객실도 깨끗했어요..
편하게 잘 쉬었어요~~
지하철역과 가까위 정말 좋았어요~~",5.0,0
2018.08.17,73846,her**,"지하철에서 가깝고 지하에 편의점도 있고
객실 컨디션도 넘 좋았어요
재방문 의사100%입니다",5.0,0
2018.08.15,73846,kaz**,"오픈한지 얼마 안된 호텔답게 청결하고 좋았습니다.
접근성도 좋고, 트랜디한 프론트 또한 인상적이었습니다.",4.5,0
2018.08.05,73846,lyj**,방 디자인이 이쁘고 뷰도 나쁘지 않고 무엇보다 침구류가 너무 푹신하고 좋아서 잘 잤습니다!,4.8,0
2018.07.16,73846,sho**,생각보다 너무 좁지 않고 깔끔했습니다. 선릉역에서 지근거리라 교통도 편리합니다. 풋스파 이용 가능한 점도 좋았습니다.,5.0,0
2018.07.10,73846,esj**,침구는 말할것도 없고 전반적으로 시설도 좋아서 만족합니다. 욕조만 있었다면 진짜 최고인데 그것만 좀 아쉽고 다 좋아요!,5.0,0
2018.06.04,73846,awe**,"깨끗 포근해요 
*라스테이보다 넓은 것 같아요 ! *라스테이에서 갈아탑니다! 
로비에서 셀프 체크인체크아웃 
아주 좋아요 !",5.0,0
2018.05.30,73846,gkn**,생긴지 얼마 안돼서 깨끗해요 직원들도 친절하고요 단점이 있다면. 욕조가 좁고 방크기는 모텔 생각하시면 돼요,4.8,0
2018.05.15,73846,ade**,"인테리어나 비품들이 너무 안좋아서 호텔이라고하기엔   너무 부족하네요.
실망스럽네요. 청소상태도 너무 불량입니다. 치약이묻는 거울과 카펫은 움직일때마다 먼지가 많이 ....ㅠ
다시는 가고싶지않은 곳이네요.",1.0,0
2018.04.22,73846,sku**,너무 만족하고 좋은 여행이었습니다 더블 베드 치고 침대가 너무 작아서 당황스럽긴 했지만 대체적으로 좋았어요,5.0,0
2018.04.15,73846,eny**,룸과 베드가 좀 작았지만 깔끔하고 편리안 점이 많아서 다음에 또 이용할 의사가 많은 호텔입니다.,5.0,0
2018.04.03,73846,soy**,"룸 컨디션도 좋았구, 위치도 좋았어요 ㅎㅎ 근데 플로팅 뷔페가 가격이 저렴하긴 했어도 쫌 부실하다는 느낌을 받았어요.",4.5,0
2018.03.25,73846,hh0**,방도 깔끔했고 시설도 좋았어요. 디너뷔페는 파스타 아니었으면 별로인듯해요~ 파스타땜에 그나마 만족~!!,4.8,0
2018.02.11,73846,luc**,처음오픈때보다 한층더 고객을생각 하는 마음이 넓고커진것울  화실히느꼈어요. L7 화이팅...,5.0,0
2017.12.29,73846,kar**,침구가 너무 좋았어요 기절하듯이 잤어요 그리고 친절하고 방도 넓었고 가성비 최고입니다!.! ,5.0,0
2017.12.26,73846,dus**,"신축이라그런지
깔끔하고 정돈되있었어요
하지만 연휴에 숙박고객들이 밀리니까 프런트에서 일처리가 조금늦어진게 불만이네요",5.0,0
2023.03.01,73846,dhf**,먼지 부분과 화장실 청소를 조금만 신경써주심 더욱 좋을것같습니다 침구도 편햇고 전반적으로는 아주봏았어요,4.3,0
2022.03.16,73846,the**,"모든게 다 좋았습니다.
단, 욕실에서 비린내가 좀 나는것같아요.
락스로 세척을 하면 좋을텐데..",4.0,0
2022.02.24,73846,sok**,"침구, 조망 등 전체적으로 마음에 들었으나
조명기구에 소트가 나서 2번이나 룸조명이
나가버려 전기기사님이 올라 와 고쳐 주셨네요.",3.3,0
2022.02.04,73846,bij**,"위치랑 반나절호캉스 하기 좋아 자주 애용 하고있어요
침구 편하고 티비는 작지만 그냥 반나절 사용하기 딱 좋은거 같아요",4.0,0
2021.12.28,73846,sma**,지난번 시티뷰 이용해서 이번엔 선정릉 뷰 이용했는데  좋았어요. 멀리 남산타워도 보입니다~,4.3,0
2021.06.08,73846,yoo**,"침구 베개가 편해서
오랜만에 푹 잤습니다
조식은 포장해서 객실에서 먹었는데
편하고 좋았어요",4.0,0
2021.02.15,73846,yhy**,치ㄴ구랑 쉬려고 갔었어요. 푹 잘 쉬었는데 방음이 좀 안되는 느낌이었어요. 쾅쾅 문닫히는 소리 기타 등등 소음이.. ,4.0,0
2020.12.09,73846,je9**,지난번에도 그렇고 이번에도 느낀게 직원분들이 정말 친절하셨어요:) 호텔내부도 깔끔했습니다~,4.0,0
2020.10.27,73846,ho_**,침구가 깨끗하고 좋았어요 위치도 좋고 친구랑 가서 1박하기에는 엄청좋네요 갈일있으면 또 방문하고싶어요~,4.0,0
2020.10.06,73846,kch**,"시설깨끗하고 접근성 좋음, 직원 친절 서비스 보통, 그러나 쓰다남은 어메니티가 비치되어있어서 4성급 호텔이라고 하기에는 관리가 미흡한듯 함",3.3,0
2020.08.07,73846,luv**,"엄청 좁고
직원들 친절 모르겠고
엘리베이터 엄청 느림
3대밖에 없어서 엄청 기다림
방도 그닥 깨끗한진.. 

가격싸고
위치만 좋음",3.3,0
2020.06.24,73846,090**,"깔끔하고, 침대도 푹신하니 좋았고, 직원분도 친절하시고, 접근성도 좋고 전체적으로 다 만족스러웠습니다!",4.3,0
2020.05.10,73846,lov**,"화장실이 독립된 느낌이라 좋았어요
침대방만보면 넓다는 느낌은 안들었지만 드레스룸처럼 따로 꾸며진 공간이 좋았어요
또가고싶어요",4.3,0
2020.05.05,73846,cry**,엄마와 갔는데 늦게까지 옆방의 소음으로  이동도 못하고 민망한경험을 했네요. 호텔이용 많이했지만 이런경험은  첨이라~,4.3,0
2020.05.04,73846,lee**,전체적으로 깔끔하고 좋았습니다 다만 침구에서 먼지가 좀 나와요 침구 세탁이랑 청소에 좀 더 신경을 썼으면 좋겠습니더,4.3,0
2020.05.02,73846,sum**,혼자 호캉스 햇는데 깔끔하고 뷰 좋앗어요. 선정릉 산책하기도 좋고. 근처에 먹을게많이 없엇네요.,4.3,0
2020.04.05,73846,wut**,"
생각보다 방도 넓고 시설도 깨끗해서 만족스러웠습니다. 
스태프들도 친절했고 특히 선릉뷰라 더 좋았습니다. ",4.0,0
2019.11.10,73846,wjt**,"저ㅂ근성이 좋고 깔끔했어요!
그런데 냉장고가 너무 작고 유리컵 대신 종이컵이 비치된 게 아쉬웠어요",4.0,0
2019.09.28,73846,749**,조식당 너무 깨끗해서 좋았구요 음식종류도 다양하구 핫밀들이 많아서 좋았어요!!객실두 깨긋하구 대만족 ,4.0,0
2019.09.15,73846,its**,"전체적으로 기대 이상이었어요!
주차장은 좀 좁고 불편한 것 제외하면!
음식은 그냥 그래요!",4.0,0
2019.08.13,73846,gre**,어매니티도 충분했고 룸 컨디션도 좋았습니다! 침구도 깨끗하고 편안하게 쉬고 왔습니다. 조식도 깔끔하고 맛있었습니다!!,4.3,0
2019.08.09,73846,wlf**,침구가 그다지 깨끗한 편은 아니었지만 매트리스가 좋아서 숙면 했어요 ㅎㅎ 런치도 아주 맛있었습니다 ! ,4.0,0
2019.08.06,73846,too**,"직원분들이 친절하시긴 하나, 미리 안내를 해주시지를 않네요.. 헤매다가 물어봐야 알려주시고 뻔히 보고 계셨는데  ㅠㅠ",4.0,0
2018.12.09,73846,yoo**,서랍을 열었더니 속옷이 있었어요; 가운도 얼룩이 안 지워져있고~ 제가 민감한 편이 아니라고 생각했는데 청결 상태는 정말 별로였어요. ,3.0,0
2018.10.01,73846,dle**,"체크인체크아웃 되게 희안해서 헤맸고
문 어째 여는지 방법도좀 알려주지 한참 헤맸어요
베개는 되게 불편하고
창문 다 닫아도 바람들어와서 추웠어요.",3.0,0
2018.09.29,73846,par**,호ㅏ장실 머리카락이 좀 걸렸지만.. 룸 자체는 좋았고! 언제나 롯데계열 호텔체인의 배딩은 좋습니다^^,4.3,0
2018.09.26,73846,kim**,샤워기 물 수압이 너무 약한거 빼고는 특별히 신경쓰이는 부분 없이 잘 지내다 왔네요~ 다음에도 재방문 의사 있어요!,4.3,0
2018.08.16,73846,hyu**,"객실은 좋았지만 침구가 약간 축축한 느낌이 있었어요.
풋스파는 물이 너무 미지근해서 아쉬웠어요.",4.3,0
2018.04.24,73846,ksc**,직원분들도 친절하시고  객실도 대체로 깔끔하고 좋았으나 카펫 청소를  조금 더 신경써주셨음해요,4.3,0
2018.01.03,73846,for**,"주차장가는 엘리베이터가 아직 공사중이라 조금 불편했어요
고층이라 경치도 좋고 셀프 인아웃이라 편함",4.3,0
2018.01.01,73846,lig**,"새 호텔이어서 깨끗하고 좋았음
그러나 주차장 진입로가 너무 좁아서 초보운전자 또는 큰차 이용자는 굉장한 주의가 요구됩니다.",4.3,0
2018.01.01,73846,soj**,"침구가 너무 푹신해서 잠이 잘왔어요!
체크인 시랑 체크아웃 때 사람이 많이서 붐벼서 혼잡한거 빼고 좋습니다!",4.0,0
2017.12.28,73846,mc2**,오픈한지 별로 안되서 깨끗하고 좋았지만 실내 온도가 너무 높아서 더워서 잠을 잘 못잤어요 ㅡㅡ,4.0,0
2022.07.20,73846,seu**,"넷플릭스 된다고 쓰지 말자.
넷플릭스 볼려면 자기 계정이 있어야 함.
TV인지 셋탑박스인지 허접해서 굉장히 느림.",3.5,0
2022.02.11,73846,kko**,"위치 좋고 상태 좋음 엘리베이터 너무 느림
엄청 오래 기다림 주차 입구 정말 헬
그와중에 위치 좋음 침구 좋음",3.5,0
2021.08.18,73846,zun**,"서비스나 시설은 만족스러웠습니다. 다만, 주차장 진입로가 너무 협소해서 큰차로 진입시에 불편함이 있었습니다.",3.5,0
2021.07.12,73846,86g**,"전체적으로 나쁘지 않았는데.가격대비 청소상태가 별로였어요, 화장실 등 좀더 꼼꼼히 청소해줬으면 좋겠어요",3.8,0
2020.11.08,73846,zin**,방에 먼지가 좀 많았던거 같아요 조명이 쎄서 더 잘 보인것도 있는거 같았는데 그랬습니다 하루밤 잘 묵고가요!,3.5,0
2020.04.06,73846,jun**,조금 좁은 방이었지만 혼자 지내기 좋았고 무엇보다 뷰도 너무 좋았어요!! 큰 창 덕분에 예쁜 노을도 보고 만족합니다 ㅎㅎ,3.8,0
2019.04.08,73846,451**,"깨끗하긴 했지만 아쉬운부분이 있었습니다
어쩌다 빠트리시고 쓰레기를 안치운게 있어서.. 
대체로 만족합니다!",3.8,0
2018.12.27,73846,dlw**,어르신분들이 가면 체크인할때 어려울거같아요 직접 입력하고 알아서 해야되서 주차문제도 그렇구 호텔은 깔끔하고 좋았어요^^,3.5,0
2018.09.02,73846,jan**,체크인 때 부터 불쾌하고 짜증났었는데 편의시설등의 이용 안내도 부족해서 좀 그랬어요. 시설이나 그런건 다 좋긴 해요,3.5,0
2023.05.15,73846,333**,뷰가 좋았어요! 방도 깔끔하고..,5.0,0
2023.05.08,73846,woa**,친절하시고 분위기좋고 위치가 너무 좋아요 일끝나고 집가시 싫어서 예약ㅎ했는데 만족합니다.,5.0,0
2023.03.16,73846,sig**,"너무 깔끔하고 고급스럽고 침구도편안했어요
서비스도 너무좋아요",5.0,0
2023.01.24,73846,ykj**,넷플릭스도 잘 볼 수 있고 8시간 반캉스 상품도 아주 만족스러웠어요,4.8,0
2022.12.11,73846,akd**,"우선 직원분들 너무 친절하시고 위치 또한 좋았습니다.
감사합니다.",5.0,0
2022.09.13,73846,dsw**,다 좋은데 어메니티가 쓰고나면 뻑뻑해지는 기분 샴푸랑 바디워시…,4.8,0
2022.09.12,73846,dks**,"혼자 다녀왔는데 너무 힐링하구 왔어요❤️
재방문할게요❤️",5.0,0
2022.07.24,73846,trv**,"조식이 먹을만했고 고층에서 바라보는
선릉의 푸르름은 힐링이 됐싑니다.",5.0,0
2022.07.05,73846,ifr**,"침구 깨끗하고 푹신하며, 편의시설 바로 지하에 있고 아주 좋았습니다^^",5.0,0
2022.07.04,73846,val**,직원분들이 너무 친절해서 숙박하는동안 너무 편했습니다!,5.0,0
2022.06.28,73846,ton**,직원분들 친절하시고 룸상태도 좋았어요 엘베가 너무 느려요ㅠㅠ,5.0,0
2022.06.09,73846,csr**,직원분들 친절하고 매번 이용할때마다 깨끗한 침구와 인테리어 좋습니다,5.0,0
2022.06.01,73846,suh**,"회사근처라 가끔 이용합니다
가족및 친지분 서울오면 추천합니다
가격대비 최고수준입니다",5.0,0
2022.05.28,73846,all**,"모든 면에서 만족스러웠습니다
족욕도 가능해서 좋았습니다.",5.0,0
2022.03.27,73846,gjd**,하나부터 열까지 모두 마음에 들었어요. 특히 직원분들께서 너무 친절하세요ㅜㅠ,5.0,0
2022.03.25,73846,csr**,"모든것이 좋았지만 주차공간이 부족해요~
나머지는 가성비 그이싱입니다",4.8,0
2022.03.25,73846,csr**,침구도 깨끗하고 직원분도 친절하고 선릉 뷰도 너무좋았는데 주차공간이 부족하네요,5.0,0
2022.03.19,73846,wkd**,접근성이 좋고 침구류가 굉장히 푹신해서 편안하게 잘 수 있었습니다.,4.5,0
