reviewAt,code,nickname,comment,avgScore,helpfulCount
2017.12.25,73846,cho**,"세면대와 타올에서 머리카락이...
청소 시 더 신경을 써주면 좋겠어요. 

그리고 엘리베이터가 조금 느린 느낌이에요. 
기다리면서 언제 올지 모르는 

위치와 전체적인 서비스는 만족합니다. ",3.8,0
2023.08.16,73846,lal**,침구가 너무 푹신하고 깨끗해서 잠이 잘왔어요! 이박 묵었는데 만족하고 갑니다~,5.0,0
2023.04.03,73846,77f**,"시설 좋고 깨끗해요.
다만 체크인이 불편한 편이고(셀프 체크인)
가성비 측면에서는 글래드나 신라스테이 보다는 밀린다고 생각합니다",5.0,0
2023.03.06,73846,jsk**,"일정이 있어서 이틀동안 있었습니다. 침구가 좋아서 잘잤는데 다른 4성급에 비해 조식은 조금 부족한 느낌이였어요. 하지만, 직원분들도 친절하고 룸 컨디션도 좋았습니다.",5.0,0
2023.02.15,73846,shi**,"룸 컨디션도 좋고 직원분들도 친절하셔서 좋았어요. 이벤트로 상품도 받아서 더 좋은 추억이 남았습니다.
뷰도 선정릉뷰로 주셔서 좋았어요!",4.5,0
2022.08.01,73846,krs**,특급인 하얏트 시그니엘 포시즌급은 부대 시설때문에 아니지만 방 곳곳에 세심한 배려를 느낄수있습니다. 편히 쉬다 갑니다. 재방문 의사는 100프로,4.5,0
2022.06.28,73846,y2s**,"같은 건물에 편의점 있는것도 너무 좋았어요!
평일에 북적한 테헤란로라 그런지!
주말은 진짜 조용하게 잘 묵었습니다!
칫솔치약은 없으니 꼭 챙기시길~!!",5.0,0
2022.03.19,73846,kj8**,객실도 깨끗하고 직원도 친절하고 너무 편하게 쉬고 갔어요~ 정말 대 만족 합니다!!^^ 지하에 편의점 있어 간단히 사먹기도 😀,5.0,0
2022.02.24,73846,yan**,산릉역 바로옆에 위치하고 있어서 지하철 이요요ㅣ 매우 편하고요..맛집이 많아서 어디가야할지 특히 고민 안해도 되는숙소입니다..특히 시설이 아주 깨끗하고 좋아요~..,5.0,0
2022.02.16,73846,paj**,"침구도너무좋고  직원들도 친절하고 룸도 깨끗하고 다좋았어요
그런데 주차가최악이에요ㅠ  차빼다가 범퍼심하게 긁어서 너무 속쓰리네요",5.0,1
2022.01.19,73846,nau**,푹 쉬고 싶어 33스테이로 예약했는데 역시 L7은 탁월한 선택이였던것 같아요 근처 맛집도 많고 배달도 잘되고 무엇보다 객실이 쾌적해서 너무나 잘 쉬다 왔어요,5.0,1
2022.01.13,73846,rnw**,"침구먼지도 적고 화장실고 곰팡이 없고 깔끔했어용!
다른 4성급 호텔들 중에 젤 만족합니다!
주차할때가 좀 힘들었지만 나머진 매우 만족이예용",5.0,1
2021.12.30,73846,kur**,"로비 안내 직원부터 체크인 프론트 직원분들까지 모두 친절하고 세심했습니다.
당일 근무하신 모든 분들 덕분에 즐거운 휴일을 보낼 수 있었습니다.",5.0,0
2021.12.19,73846,bor**,"주차장 내려가는 길이랑 주차공간이 넓지 않은 것 말고는 청결, 직원 서비스, 접근성 모두 최고에요. 
스탠다드인데 방도 넓은 편이에요. 신라스테이보다 훨 나은듯하네요.",5.0,0
2021.12.12,73846,hhh**,"룸컨디션도 매우 좋았으며,
체크인 시 직원분들 역시 굉장히 친절해서 기분좋은 숙박을 할 수 있었습니다.
다음 번에 기회가 된다면 또 이곳에서 숙박하고 싶습니다.^^",4.8,0
2021.12.02,73846,sol**,"꼭대기층 받아서 뷰도 정말 좋고 침구 화장실 다 깨끗해서 잘 이용하고 나왔어요 직원분들 친절하세여
방크기도 나름 커서 답답하지않았구여 
다음에 또 올 의향 있어용",5.0,1
2021.11.21,73846,hwa**,침구도 깨끗하고 폭신해서 잠도 푹잤어요 선릉역에서 오분거리정도 밖에 안되서 접근성도 좋고 주위에 스타벅스 올리브영등등 있어서 좋았습니다,5.0,0
2021.11.18,73846,ksm**,주차장가려면 옆건물로 또 엘레베이터 타야되는거빼곤 괜찮았어요. 주차장 협소한것도 좀불편했어요 잠깐 외출하고 왔는데 만차더라고요,4.8,0
2021.10.11,73846,pdd**,"청소가 잘 되어있었고
고층에 가든뷰 요청했더니 바로 해주셨어요
3시보다 일찍 체크인했는데도 친절하게 해주셨습니다
뷰가 정말 좋고 고층이라 프라이버시도 잘 지켜졌어요",5.0,0
2021.08.23,73846,ttu**,침구도 폭신폭신하고 무엇보다 직원분들이 전부 다 친절하셔서 너무 좋았어요ㅠㅠ.. 예약 잘못해서 당황했었는데 친절히 도와주시구ㅠㅠ 넘넘 좋았어용!!!!,5.0,0
2021.07.07,73846,ps2**,"선릉역 바로 앞이어서 위치가 좋고 룸 컨디션과 침구, 어메니티 모두 좋았습니다. 주차장 층별 진출입 통로가 매우 좁으니 큰 차들은 긁힘 주의",5.0,0
2021.06.19,73846,rkd**,"3박을 하였는데. 강남일대 접근성이좋고
호텔안 로비공간이 넓어 간단한 미팅하기도
좋구요. 가성비좋고 시설 밎 써비스 직원들이
친절하여 좋은시간을 보냈습니다",5.0,0
2021.06.16,73846,ckh**,"침구도 편안하고 방도 깨끗하고 직원분들도 친절하고.
근데 방마다 tv가 다른가봐요 어떤방은 스마트tv고 어떤방은 약간 최신이 아닌 tv구요",5.0,0
2021.05.31,73846,joo**,33시간 메리트가 있어서 매번 이용하는 곳인데 항상 만족하고 있습니다! 그런데 이번에 배정 받은 방은 화장실 문이 잘 안 닫히는게 조금 흠이었네요  ㅠㅠ,4.5,0
2021.04.25,73846,tjw**,"직원들의 친절과 서비스도 정말 최고였어요 ㅎ
방도 너무 깨끗하고 
푹 쉬다 갔어요~ 다음에도 가족이랑 친구랑 
또 오고 싶네요 ㅎ",5.0,0
2021.04.04,73846,tom**,새ㅇ각했던것보다 시티뷰는 기대에 못미쳤지만 전체적으로 너무 깔끔하고 직원들께서 너무 친절했던 기억으로 남는 여행이 되었던것같아요~,4.8,0
2021.04.01,73846,rak**,엘베 층수 표시 안되는것과 주차 입출입구가 너무 좁은거 말고는 다 좋았어요!패밀리룸 이용해서 고층이 아니였어요 미리 알지못함에 아쉬움 그래도 너무 편안하게 잘 있다가 왔습니다!,5.0,0
2021.02.17,73846,hye**,"아메니티 부터 직원 분들의 세심한 친절까지 정말 좋았습니다. 로봇으로 전달해주는 시스템도 돋보이구요. 
위치도 대박. 산 뷰 가 역시 더 좋아요! ",5.0,0
2021.02.15,73846,dis**,"전체적으로 만족했습니다. 
서비스나 퀄리티 
나이트 뷰 등등 

지하주차장 가려면 1층에서 
갈아타야 되는거 빼면 
전체적으로 무난무난",5.0,0
2021.01.19,73846,sky**,"33시간 스테이였는데 여유롭고 깨끗하고 접근성도 좋아 너무 잘 쉬다가 왔어요~
특히 직원분들이 너무 친절하시더라구요ㅎㅎ 자주 가고싶네요",5.0,0
2020.12.19,73846,moo**,"뽀송뽀송 침구 관리도 좋았고 직원분들 친절한 응대 등 모두 만족합니다. 그럼에도 불구하고
주차장 주차하는 순간부터 좁은 램프 주차장 나올 걱정에 호캉스는 안녕...",4.8,0
2020.11.18,73846,ssu**,"직원분이 친절히 안내해주셨고, 어려운부분이나 혼란스러울뻔한 부분이였는데 안내를 잘해주셨어요
체크인과 체크아웃까지~!

식사는 뷔페라햇는데 아쉽게 못한게ㅠ 다음에또 들리고싶네요",5.0,0
2020.11.03,73846,고객님,"얼마 안되서 그런지 오래된 호텔 냄새가 안나서 좋았어요.
직원들도 친절하고, 서비스 대응도 만족해요.
저렴한 가격에 절 다녀왔어요.",4.5,0
2020.11.01,73846,als**,"너무 좋았어요 ㅎㅎ 직원분이 너무 친절하십니다 ㅠㅠ ㅎㅎ 
낮은층이어서 슬펐는데 수페리어로 업그레이드 해주시고ㅠㅠㅠ ㅎㅎㅎㅎ 기분 좋은 하루였어오",5.0,0
2020.10.02,73846,mar**, 깔끔하고 쾌적했던 숙소입니다. 접근성도 좋고 직원분들도 매우 친절했어요. 가성비 최고의 호캉스였던 것 같아요 다음에 또 생각날 것 같습니다.,4.5,0
2020.09.27,73846,cha**,모자란거하나없이 좋았어요 친절하구 다만 침대옆 간이테이블이 청소가 안되어있었어요 각티슈도 케이스만 덜렁있고 테이블도 초콜렛인가뭔가흘려있고,5.0,0
2020.08.22,73846,hik**,조용하고 시설도 좋은데 가장 칭찬하고 싶은건 직원분들의 태도에요. 시종일관 친절하고 손님들을 배려하는 태도에 감동했습니다 !! 직원분들 때문에 또 가고 싶어요. ,5.0,0
2020.06.27,73846,ho8**,"우ㅣ치좋았구요 직원분들도 넘 친절하셨어요
룸컨디션도 좋았구요 다음에 또 이용할 의향있어요
다만 주차장들어가는 입구가 넘 좁았고 주차장이 협소했어요 큰 차는 위험할듯하네요",5.0,0
2020.06.08,73846,sha**,"호텔 자주 이용하는데 유난히 기억에 남네요.
일단 방이 넓고, 화장실과 공간이 딱 나눠져있어서 좋았어요.

침구류가 정말 푹신해서 잠 잘잤구요.
애어컨도 빵빵했네요.",5.0,0
2020.05.13,73846,jjj**,침구가 매우 편안했습니다!! 직원분들 모두 친절하셨어용 주차도 너무 편히했고요! 근데 첫날에 복도에서 이상한 냄새가 나긴했는데 다음날은 괜찮았어요,4.8,0
2020.05.05,73846,ann**,레이트 체크아웃이 6시까지인 상품이 너무 좋았습니다. 다른 곳에는 없는 늦은 시간까지 쉴 수 있는 상품이라 이 곳을 선택했던 것 같네요. 좋았습니다.,5.0,0
2020.05.01,73846,ozn**,"침구 푹신하고 방 컨디션 좋았어요, 근처에 편의시설이 많아서 좋았고 위치도 좋아요. 푹쉬고 즐겁게 놀다 갑니다. 다음에도 이용하고 싶어요 :)",5.0,0
2020.04.10,73846,kdw**,"선,정릉 뷰였음 더 좋았겠지만 층수도 꽤 높아서 만족했습니다 직원분들 너무 친절하시구 객실도 깔끔하니 좋았어요~! 기회가 된다면 재방문 하고 싶네요",5.0,0
2020.03.22,73846,k3_**,"케이크 보관 및 와인잔 대여도 친절히 해주셨습니다! 
시티뷰도 미리 연락드리니 가능한 범위 안에서 도와주셨어요. 다음에 또 방문하겠습니다! ",4.5,0
2020.03.01,73846,bar**," 접근성도 좋고 전체적으로 깔끔했습니다
복도에 얼음 정수기가 비치되어 있어서 편리했고 런치 뷔페 역시 깔끔하고 가짓수도 적당하고 맛도 훌륭했습니다",4.8,0
2020.01.29,73846,lon**,치ㅁ구도 깨끗하고 너무 좋앗아요. 베개가 너무 푹신하고 이불도 좋은 이불인게 느껴지더라고요. 청소상태도 괜찮았습니다. 선릉역이랑 가까워서 교통도 좋았어요. ,4.8,0
2020.01.17,73846,fig**,"디좋았고 조식은 연박일때는 굳이.. 매일 같은 메뉴예요.
국정도는 바뀔수도 있을거 같은데..그래서 .2일 조식먹고 3일째는 밖에서 먹었어요^^",4.5,0
2019.09.23,73846,nhn**,조식도 훌륭하고 전망도 선정릉이 보이는 뷰라 좋았습니다. 이번에 IBA로 인해 방이 없어 비록 하루밖에 못 묵었지만 더 시간을 보내고 싶습니다.,5.0,0
2019.08.25,73846,spa**,시설도 좋고 깨끗했어요! 살짝 먼지가 많은 감이 없잖아 있지만.. 전체적으로 만족이요!!! 3시 체크아웃이라 정말 좋았어요 ㅎㅎ,5.0,0
2019.07.19,73846,hkh**,"위치도 좋고 침구가 편해서 잘 쉬다 왔어요
풋 스파도 소소하고 좋았고
묵은날 저녁 8시쯤 와인 잔 부탁드렸는데 직원분이 친절하게 대응해주신 게 기억에 남네요 ~~",5.0,0
2019.06.06,73846,dld**,"프론트 직원 분들도 친절해서 좋았습니다. 룸도 깨끗하고 뷔페도 맛있었어요. 그리고 족욕할 수 있게 되어있어 더 좋았어욤!
고층 요청했는데 고층으로 배정해주셔서 더 좋았습니당!",5.0,0
2019.02.07,73846,ko4**,"요근래 가본 호텔중에 가장 가성비가 좋았던거 같아요. 
저희 커플이 좋아하는 작은 헬스장도 있었고, 
근처에 가까운 마트도 있어서 좋았어요. 
",5.0,0
2018.09.26,73846,hen**,"깨끗하고 좋아요 선정릉쪽뷰방으로 방받으세요!! 조경야경 다 좋아요!!
(엘리베이터가 좀 늦게오는게 단점인데 그정도야.. ㅋㅋ)",5.0,0
2018.09.23,73846,h54**,객실이 깨끗하고 먼지도 없었어요. 방음도 좋았고 공기도 좋았구요 수압은 약간 아쉽긴해도 충분히 만족했어요. 가격만 맞는다면 재방문의사 있습니다. 조식은 가격대비 살짝 애매한듯요,4.8,0
2018.09.09,73846,jan**,"접근성, 시설, 침구류 등등 전반적으로 만족했습니다. 다만, 주차장은 기본적으로 협소하고 여유가 별로 없는 편이네요. 대중교통이 편할듯 합니다.",5.0,0
2018.09.03,73846,siy**,전체적으로 너무 좋고 편했습니다. 직원분들도 친절하시고 방의 공간배치도 좋았구요.  하지만 도로변쪽 방을 배정받아서 오토바이 소리때문에 밤에 잠자기가 좀 힘들었어요ㅜㅜ,4.8,0
2018.08.30,73846,ina**,대만족! 매우 깨끗합니다. 하우스키퍼분께서 몹시 친절하시고요. 프론트데스크 직원분도 친절하셨습니다. 다만 비싼 편이라 자주 이용은 못하겠네요.,5.0,0
2018.08.18,73846,jui**,침구깔끔하고 주차 나름 괜찮고 접근성도 좋고 강남에서 여기저기 놀기 좋았습니다. 직원분들도 친절하셨고. 다만 방음이 좀 안되서 당황스러웠지만 잘 쉬었다 갑니다:),5.0,0
2018.02.21,73846,jom**,무인호텔이라해서 조금 걱정도 했는데 안에 직원분이 계셔서 친절하게 안내해주셔서 잘 지내고 왔어요 다음에 또 다시 방문예정입니다 ㅎㅎ,4.5,0
2023.01.23,73846,sks**,"방도 너무좋았고 추가금내고 방 업그레이드되어서 너무좋았어요.
비염때문에 먼지에좀 민감한데 먼지가 많아서(카펫.침구애서나오는먼지) 콜록거렸어요
직원분들 너무 친절하셔서 좋았어요",4.3,0
2022.10.04,73846,qkr**,"결혼 예식전날 밤 장모님을 모시고 잠만 자게 되었는데… 잠을 하나도 못잤습니다…모든 방이 그렇지는 않겠는데 저희가 처음에 들어간방은 소독약 냄새가 너무 심해서 다른방으로 교체를 해주셨고 그방은 냄새가 안났습니다
근데 새벽4시부터 화장실에서 아주 높은 고주파소리? 쇠소리가 들려서 정말…잠을 너무 설쳤습니다ㅠ 그래서 정말 환불까지 하고 다른데 가서 자고싶었는데 그럴수도 없었고 호텔에서는 그냥 죄송하다는 말씀뿐이였고…뭐 어떤 불편함에 대해서 서비스가 레이트체크아웃뿐인게 … 새벽에 통화 받으셔서 조식권조차 주실수 없다는 직원의 단호한 태도에… 그냥 환불요청을 할걸 그랬다는 후회가 드네요",3.0,4
2022.03.16,73846,bij**,"주차가 조금 어렵긴하지만 항상 잘 애용하고있어요
위치가 좋고 체크인두 빠르게 진행되고 객실두 너무 좁고 답답하지기 않아서 만족합니다",4.0,0
2022.03.15,73846,gjr**,"먼지도 많이 쌓여있고.. 조식도 들어가자마자 프론트 계시는분은 응대해주시지도 않고 통화하고 계시더라구요! 바로 나오는 음식도 스탠바이 하고 있지 않아서 보고있다가 나오는거 확인하고 주문해서 겨우 먹을 수 있었어요.. 가격에 비해 품질이 떨어지는 느낌이었습니다. 신라스테이랑 비슷하게 가려한 것 같은데.. 진짜 쇼파? 스웨이드 재질로 된 의자도 너무 더럽고, 솔직히 침대도 퀄리티가 그저그런 정도였습니다. 신라스테이는 적어도 침대 퀄리티는 괜찮았다고 생각하는데.. 여기는 청결도 떨어지고, 조식이 뛰어난것도 아니고 롯데 계열이라고 해서 기대했는데 차라리 롯데 호텔을 갈 것 같아요 ㅠㅠ",3.0,0
2022.03.01,73846,uox**,"바닥 카페트, 책상 등 전체적으로 먼지가 많고 깨끗하게 청소가 되지는 않은 느낌이었어요 기관지가 예민한 편인데 계속 기침도 나고 침구는 편했어요",4.3,0
2021.12.31,73846,kui**,갑자기 담배냄새가 욕실안으로 들어왔고 호텔측에서 친절히도 룸 바꿔주신다더군요 하지만 제가 사양하니 공기청정기 넣어주시는 배려를 해주셔서 너무 감사했어요~^^,4.3,0
2021.12.13,73846,sou**,가격대비 방도 크고 룸도 조용한쪽으로 배정해주셔서 만족스럽게  투숙했습니다. 선릉에 볼일이 있어서 갔는데 접근성도 좋고 좋았습니다,4.3,0
2021.12.05,73846,soo**,전체적으로 깨끗하고 깔끔해서 좋았는데 카페트가 조금 젖어있는 부분이있어서 당황했어요 어쩔수 없는 부분이긴했지만 조금 아쉬웠고 그외에 것들은 모두 만족스러웠습니다,4.0,0
2021.08.09,73846,shi**,"데일리호텔에서 바로 구매 후 이용했는데. 데일리호텔의 상춤은 룸 타입이 체크인시 배정으로 싱글베드 타입보다 높은 가격인데도 구매했음. 
그런데 체크인 할 때 더블로 방 배정 받으려면 돈을 추가로 내라고 하는 거임. 내가 배정시 타입 정하는 건데 왜 돈을 또 내냐고 물으니. 체크인시 배정이라 배정받으려면 기다리라고 하는거임. 이미 저녁 7시쯤인데 뭘 더 기다려야하는지 이해불가. 그래서 더 불편하고 더운 리렙션에서 기다리기 싫어 그냥 돈 더 냄. 
상품 구성 설명 엉망. 응대 엉망. 일 좀 제대로 해서 구매한 고객 불편하지 않게 해주길 바람.",3.3,0
2021.04.17,73846,joo**,두 번째 이용이고 전체적으로 만족스러웠는데 옆방에서 흡연을 하니 냄새가 다 들어오더라고요... 객실 내 금연일텐데 좀 더 잘 관리가 돠었으면 좋겠네요 ㅠ,4.3,0
2021.03.21,73846,can**,"지ㅂ근처라 자주가는편인데 직원분들이 친절하게 케어해주셔서 잘 쉬다왔어요
다만 호캉스?시즌이다보니 방문객이많아 약간 시끄럽고 정신없는점은 좀 그랬지만요ㅠ",4.3,0
2021.01.23,73846,usb**,"좋습니다.
확실히 주차장 올라가고 나려가는데 좀 좁습니다만

운전 오래하신 분들은 천천히 하면 다 통과 가능하십니다.

평일이라 주차장 여유도 좀 있었구요..

만족합니다.",4.0,0
2020.12.27,73846,smg**,"침대가 너무좋네요,, 개꿀잠잤어요 어떤 침대 사용하는지 알고싶어요,, 가본곳중에 체고에요 ,,집에있는침대 갖다버리고싶은정도네요,,",4.3,0
2020.03.13,73846,ale**,"뷰가 너무 좋았어요:) 다만 화장실 샤워부스 문을 열엇는데, 물비린내같은 안좋는 냄새가 확 나서 조금 당황했어요...
나머진 전부 좋았고 대체적으로 만족했어요 !",4.3,0
2020.02.02,73846,jam**,가습기 요청해서 잘 보내고 왔어요! 카펫룸이여서 먼지는 많은 편이였지만 가습기가 공기청정기능도 같이 되서 밤새 틀고 지냈네요! ,4.0,0
2020.01.28,73846,kky**,데스크직원이 너무 이쁘게 웃어주고 친절해서 덩달아 기분좋아지고 좋았어용! 방도 깨끗하고 다만 뷔페에선 직원이 작은실수를 해서 약간 기분이 조금 상했지만 괜찮았어요 만족합니당!,4.0,0
2020.01.25,73846,pia**,"가격도 합리적이고 방도 깔끔한편, 뷔페도 맛있었어요~ 실내 공기, 온도 습도가 조금 아쉬웠네요. 새 건물 특유의 냄새가 계속 났고 좀 건조했습니다.",4.3,0
2019.12.15,73846,mom**,슈페리어 더블룸이었는데 침대가 너무너무 작았어요. 방 안도 지나치게 건조했고.. 가장 불편했던건 엘리베이터가 너무 느리고 수용인원이 적은 점이었어요. 접근성이 좋은 점은 좋아요.,4.0,0
2019.11.30,73846,eun**,"시설도 깨끗하고 직원들도 친절했고 전철에서 가까와  대중교통 이용이 편리했어요
하지만 주차장은 좀 아쉬웠네요 진입로가 너무 좁고 주차공간이 협소했어요",4.3,0
2019.09.23,73846,tjd**,방에서 방구냄새같은 악취가 계속나서 카운터에 뮨의했는데 만실이라고 25층에서 11층으로 내려가야된다고 그래서 공기청정기 받아서 틀어놨는데도 냄새가 남아있어서 불쾌했음,4.0,0
2019.06.16,73846,oui**,"좋았어여 근데 점심은 너무 기대 안하고 가시는게 좋을것 같아요^^아 해산물볶음밥이 맛있어요!!!
룸컨디션은 욕조도 없어서 좀 ㅜ
그냥저냥 가볼만한거 같아여 ㅎ",4.0,0
2019.01.27,73846,ari**,"밤늦게 입실하게되어 레이트체크아웃(3시퇴실)
결제했는데 오전12시 되기도전에 퇴실하라는 전화.레이트 체크아웃 결제한거라 말해도 막무가내로 자기네는 체크안되었으니 나가라고 말도 참 싸가지없게 하던 여자직원..고객이 레이트체크아웃 결제했다고 하면 
적어도  다시 체크해보겠고 하는 흉내라도 내야하는거 아닌가..!? 서비스업 하실꺼면 교육부터 다시 받고오셈",3.3,0
2019.01.18,73846,eun**,프론트에있는 사람들이 왜 있는지 잘모르겠어요. 건성건성한 태도가 보였습니다. 사전에 뷰에대한 설명이있었으면 좋았을텐데 그런게없어서 아쉬웠습니다. ,4.0,0
2018.11.09,73846,luv**,"신*도 **스테이랑 장충동 너무 다르듯이 
롯데도 시****하고 엘세븐하고 
격차가 너무 커요 비교대상이 안되긴 하지만요..
룸업글 받아서 감사했는데 (혼자인데 패밀리룸을 주심
아무 쓸모없는 느낌ㅎㅎ;)
도로뷰 배정받아서 그런지
차소리가 너무 시끄러워서 잠을 제대로 못잤어요
침구는 편하고요 엘세븐 다른곳도 가봤지만
청소가 항상 만족스럽지 않아요
딱 보면 깨끗해보이는데 
자세히 보면 군데군데 얼룩이나 덜청소된 느낌이 있어요
그리고 샤워장 냄새가 너무 거슬려요
체크인아웃을 기계로 하고 도우미 분들이 있는데
친절하시긴 하는데 아이컨텍해도 멀뚱거리기만 하고 (인사 정도는 해야죠) 일처리가 능숙하지 않고 로비가 번잡스럽기만 해요 정신 사나운 느낌?
객실에 비누도 없어서 요청해야했고
생각보다 공간이 넓진 않아요
또갈것 같진 않아요 그래도 스벅기프트랑 롯데시네마 티켓 주셔서 조금이나마 본전은 뽑은 느낌.. 구성은 좋은 거 같네요


",3.3,0
2018.11.07,73846,god**,조식 조금 가격대가 있었지만 깔끔하고 맛있었습니다! 저는 커플여행으로 묵었지만 가족 또는 친구도 괜찮은 숙박 하실 수 있을 것 같아요.,4.3,0
2018.08.14,73846,cha**,룸컨디션은 좋았으나- 청결상태는 잘모르겠어요- 매일 침구를 갈아주시긴하는데 시트나 수건이 깨끗하진 않았어요~ 그러나 접근성+신축+전망+편의시설이 매우 만족스러웠습니다.,4.0,0
2018.08.06,73846,nic**,베개에 뭐가 묻어있었지만 뷰도 좋았고 하이볼이 필요해서 요청했는데 메이드분인지 하우스키핑 직원분인지 너무 친절하게 갖다주셨고 침대가 너무 편해서 간만에 잘 잤어요,4.0,0
2018.06.19,73846,mjp**,체크인 친절하게 도와주시고 호텔 곳곳에 직원들 계셔서 편했어요 다만 주차장이 너무 좁아서 오르고 내릴때 사이드미러 엄청 긁힐듯ㅠ,4.3,0
2018.03.24,73846,mis**,침구도 좋고 전망도 나쁘지않네요 ㅎㅎ 차 갖구갔는데 주차장나오고들어가는 입구가 좁아서 운전하는덴 좀 불편했어요 롯데호텔 계열인지 몰랐는데 롯데호텔 계열이더라구요 깔끔하고 좋았어요,4.0,0
2018.02.27,73846,yeu**,"룸컨디션은 좋으나, 체크인시 키오스크 시스템이 아직 정착 못한듯 하네요. 주차장 진출입로 램프는 매우 협소하여 주의를 요합니다. ",4.0,0
2017.12.24,73846,kik**,"접근성 좋아요 
다만 주차장 들어가는 폭이 너무 좁아요 
운전에 어려움을 느낄정도였어요ㅜ
룸상태는 좋았고 직원분들 친절하시고 편하게 잘 쉬었습니다
",4.3,0
2022.10.09,73846,sta**,"주차장 진짜 최악 
그나마 자리없어서 나한테 돈내고
알아봐서 밖에 주차하라는거 
말이 안된다고 
차량으로 예약했다 하고 항의하니
다른 건물 주차장 알려줌
초행길이라 그 주변을 네바퀴 돌다가
못찾고 성질나서 다시 물어보려고 호텔 건물앞에 차대니 무슨일이냐고 그제사 나와봄
다시 다섯번만에 겨우 옆건물에 주차ㅡㅡ
진짜 최악",2.3,0
2022.10.02,73846,dus**,"새벽 1:49경 화재경보 울려서 잠에서 깼어요

그냥 자긴 했지만

숙박시설 이용중에 처음 있는 일이라 당황;;

체크아웃 하는 날은

출입구부터 전신거울 있는 라인까지

천장에서 물이 뚝뚝 뚝 떨어져서

이런 일 또한 숙박시설 이용중 처음 있는 일이라 당황;;

시설은 깨끗한 편이었으나

좁았어요..",2.8,0
2022.06.13,73846,imk**,직원들 서비스는 정말 친절하고 좋았어요. 그런데 방에 먼지나 진드기 때문인지 알러지가 일어나서 약 사다 먹었어요. 뷰는 맞은편 고층 건물이 가까워서 선정릉쪽이 트여있고 좋아요.,3.8,0
