reviewAt,code,nickname,comment,avgScore,helpfulCount
2022.03.03,73846,kys**,선정릉뷰였는데 매우 조용하고 깨끗해서 푹 잘 쉬었습니다^-^,5.0,0
2022.02.18,73846,see**,"지하의 편의점, 친절함, 쾌적함, 모든게 언제 가도 힐링되는 곳!",5.0,0
2022.02.15,73846,swe**,직장근처라 가봤는데 접근성도 좋고 깨끗하고 아주 좋네요,5.0,0
2022.01.31,73846,for**,생각보다 아주.좋았습니다. 주차장이 너무 협소한거빼고 다 좋았습니다.,5.0,0
2022.01.27,73846,jun**,항상 갈때마다 직원분들이 친절하셔서 기분좋은 여행온것같습니다,4.8,0
2022.01.22,73846,roh**,침구가 깨끗하고..왕릉 뷰가 넘 좋았습니다..^^*^^,5.0,0
2022.01.10,73846,drk**,"방 좋았어요 선릉이라 맛집도 많아요
일욜에 안여는데가 많은건 함정이지만",5.0,0
2021.12.03,73846,iso**,"방도 깔끔하고 직원분들도 친절했어요
스위트룸도 상품 올라왔으면 좋겠어요!",5.0,0
2021.11.23,73846,noo**,요청사항들 넘 친절하게 들어주시고 가을의 선정릉뷰가 좋아서 또 가고 싶네요,5.0,0
2021.11.16,73846,usu**,침구가 푹신푹신해서 잠을 잘 잤어요. 다음에도 근처에 오면 머물 의향있어요.,4.8,0
2021.11.16,73846,dj9**,"깨끗했어요! 
넷플릭스도 나오는게 최대장점 풋스파도 잘이용했습니당",5.0,0
2021.11.12,73846,kbj**,"직원분들도 친절하시고
방도깨끗 하고 좋았습니다.
또이용하고 싶어요^^",4.5,0
2021.09.25,73846,jie**,선정릉뷰 너무 좋고 L7 직원분들 다 친절해서 갈때마다 기분좋아요 ^^,5.0,0
2021.09.22,73846,win**,"고층 파크 뷰도 좋고 침구도 편안,
직원들도 특급호텔 만큼 친절해서
정말 잘 쉬고 왔네요",5.0,0
2021.07.21,73846,eun**,"침구가  넘깨끗하고 포근합니다
직원분들도 너무친절해서 기분이 좋아지네요",5.0,0
2021.07.09,73846,gnl**,방이 너무 깔끔하고 1층 안내원부터 친절하셔서 좋았습니다,5.0,0
2021.07.06,73846,jjw**,정릉뷰로 공사중이였지만 소음은 심하지 않았고 잘머물렀습니다~,5.0,0
2021.06.28,73846,rla**,침대 시트에 얼룩이 있었지만 말하니까 바로교체 해주더라고요 그거 빼고는 만족했습니다,4.5,0
2021.06.26,73846,jus**,직원분들이 너무 친절하게 잘 대해주셔서 좋은 추억 남기고 가요 감사합니다,5.0,0
2021.06.04,73846,hit**,침구가 진짜 최고!!! 그리고 밤에 보는 시티뷰 또한 엄청 좋았어용 ㅎㅎ,5.0,0
2021.05.31,73846,kyo**,특별한 단점은 없었습니다 다음번엔 선정릉 뷰에서 숙박해보고 싶네요,5.0,0
2021.05.18,73846,ii2**,생각보다 방이 넓고 침구가 정말 좋아서 편히 쉬었습니다.,5.0,0
2021.04.29,73846,dda**,"친절했어요
급하게 예약하고 갔는데 깨끗하고 
방은 도심이라 좁음",5.0,0
2021.04.19,73846,jiw**,항상 믿고 이용하는 L7입니다. 직원들이 매우 친절하고 시설도 깔끔해요.,5.0,0
2021.04.05,73846,jiy**, 직원분들 너무 친절하시구 객실도 깔끔하고 침구도 너무  편안해서 잘 쉬다 왔습니당ㅎㅎ,4.5,0
2021.03.26,73846,sm5**,베드가 넘 푹신하고 깨끗했어요~도심 한복판에 이런 뷰라니~기대 이상이었어요~~~,5.0,0
2021.03.10,73846,hee**,깨끗하고 좋았어요! 무엇보다 넷플릭스가 돼서 좋았습니다.,4.8,0
2021.03.02,73846,hju**,"편안하게 잘 쉬었습니다
한가지 주차장 들어가는 램프는 진짜진짜 협소합니다!",4.8,0
2021.03.01,73846,gus**,역이랑 가깝고 편의점이 지하라넘좋았어요 침대가 너무푹신해요,5.0,0
2021.02.28,73846,jsw**,"너무 깨끗하고 좋았어요!
하지만,,, 엘레베이터가 타기 힘들다는것 말고는 최고에요!",5.0,0
2021.02.23,73846,bir**,"공원뷰라 야경이 예뻤습니다
룸 인테리어도 모던하고 좋았어요",4.5,0
2021.02.22,73846,xox**, 수서에서 바로 오기 편함 교통편 편하고 역과가가움 비지니스로 굿,5.0,0
2021.02.10,73846,ghu**,다른것들은 다 좋았습니다만 넷플릭스 이용방법 설명서가 있으면 좋을것 같습니다~,4.5,0
2021.01.28,73846,ror**,침구에 머리카락 한두개는 세탁시 묻어나온거겠죠 전반적으로 만족하고 포근하게 잘잤어요,4.8,0
2021.01.18,73846,abc**,깨끗하고 난방도 잘되고 무엇보다 직장이랑 가까워서 좋았습니다,4.5,0
2021.01.05,73846,jao**,"체크아웃 때 배려해주신 직원 분도 친절했고, 방 컨디션, 뷰 전부 만족스러웠습니다.",4.8,0
2020.12.26,73846,ksu**,"주차장 빼고는 다 만족이에요
주차장은 여전히 불편해요...

방이랑 서비스는 매우만족",5.0,0
2020.12.20,73846,dld**,"모든 부분이 다 좋았습니다.
다만 주차장이 좁아 자리가 부족하네요",4.5,0
2020.12.01,73846,cut**,치ㅁ대가 너무 푹신해요 ㅠㅠ 냉장고 작은거 빼고 다 만족!,4.8,0
2020.11.26,73846,dld**,느낌이 좋은 호텔이었어요. 깨끗하고 위치좋고 재밌고 편하게 쉬다 갑니다 ^^,5.0,0
2020.11.16,73846,hih**,"먼지날리는거 빼고는 너무도 좋았어요!!
친절하고 청결하고!!!!
또 방문할거에요 ㅎㅎ",4.8,0
2020.11.12,73846,thi**,루ㅁ이 무척 깔끔했습니다. 직장 동료와 함께 지내기에 적합했습니다.,4.5,0
2020.11.07,73846,cha**,주차장이 건물 외관 대비 너무 진입로가 좁음 아주 골아프더라고요 30년 넘은 건물인줄,4.8,0
2020.10.30,73846,yug**,"위치좋고 방도깨끗해서 좋았어요
이번이 두번째 이용인데 다음에 또이용할께요:)",5.0,0
2020.10.26,73846,ilo**, 전체적으로 깔끔하고 세심한 디테일이 좋았습니다. 직원들도 친절했습니다.,5.0,0
2020.10.04,73846,shi**,물을 자주 달라고 요청했는데 빠르고 친절하게 가져다주셔서 정말 감사했어요!!ㅎㅎ,5.0,0
2020.09.12,73846,yeu**,구웃 ㅎㅎㅎㅎㅎㅎㅎㅎㅎㅎㅎㅎㅎㅎㅎㅎㅎㅎㅎㅎㅎㅎㅎㅎㅎㅎㅎㅎㅎ,5.0,0
2020.07.27,73846,bre**,"침구가 정말 포근하고 폭신했어요~^^
저렴하게 뷔페까지 이용하고 넘 만족이요!!",5.0,0
2020.07.27,73846,hju**,치ㄴ절하시고 좋았어요 다만 주차장 통로가 좁아 힘들었어요ㅠ,5.0,0
2020.07.22,73846,spy**,"선릉역 근처라 좋습니다.
친절하시고 편하게 지내다 왔습니다",4.8,0
2020.07.19,73846,k30**,다들 친절하시고 매우 깨끗합니다. 침대가 아주 푹신하고 특히 10층 레스토랑도 맛있습니다,5.0,0
2020.06.29,73846,tna**,"너무 푹신하고 ㅡ커튼치니 세상 피곤했는데
어두컴컴하니  푹잤어요",5.0,0
2020.06.25,73846,lon**,"아쉬운게 있다면 TV 스포츠채널이 안나오는 채널있더라구요
나름 특2급인데...",5.0,0
2020.06.02,73846,gkr**,"침구 깨끗
위치 탁월
풋스파 의외의 개꿀
주차 약간 아쉽. 주변 공영주차장 이용 권유",4.8,0
2020.05.30,73846,lea**,침구가 너무 좋다고 여자친구가 칭찬했어요 뿌듯해요 가성비갑,5.0,0
2020.05.28,73846,jin**,"동 가격대 호텔 대비 우ㅣ치, 방상태, 서비스 모두 좋았습니다.",4.8,0
2020.05.28,73846,jao**,뷰도 좋고 뷔페도 맛있고 전반적으로 크게 만족스러웠습니다. 또 이용하고 싶네요!,4.8,0
2020.05.24,73846,cjy**,침구에 먼지가 묻어있긴 했는데 심한 건 아니였어요. 전반적으로 만족해요.,4.8,0
2020.05.10,73846,psi**,깨끗하고 전체적으로 깔끔하고 좋았습니다. 주차장이 좁은게 조금 아쉬워요!,4.8,0
2020.05.06,73846,jki**,너무 좋았어요! 직원분들도 매우 친절하시고 방도 뷰도 위치도 모두 좋았습니다!,5.0,0
2020.05.06,73846,sun**,너무 좋았고 깔끔해서 재방문하고 싶어용 호캉스에는 최고!,5.0,0
2020.05.02,73846,jg9**,풋스파를 기대하고 갔으나 아직 이용이 되지 않는다고 하여 아쉬웠습니다,4.8,0
2020.05.02,73846,tan**,새로 지은 곳이라 그런지 깔끔하고 좋았습니다! 주변에 맛있는 식당들도 많습니다~,5.0,0
2020.04.16,73846,mam**,침구가 푹신하고 좋앗어요 주차장 통로가 좀 좁긴하지만 자리도 여유있었네요,5.0,0
2020.04.13,73846,met**,침구상태도 너무좋고 근처에 접근성도 좋고 방도 선정릉뷰로 주셔서 잘쉬다갑니다,5.0,0
2020.04.12,73846,par**,"주말 손님이 많음에도 불구하고 직원분들이 친절하게 잘 응대 해 줬습니다. 
",4.5,0
2020.04.11,73846,jsw**,샤워실에 약간의 물때가 있기는 했지만 나머지 부분은 너무 좋음!,4.5,0
2020.03.12,73846,twe**,이시국에 확실히 방역에 힘쓰고 깨끗하고 잘지내고왔습니다 ,5.0,0
2020.03.09,73846,a01**,코로나 때문에 뷔페음식이 거의 없었고 주문한 파스타도 너무 짰어요. 진짜 짰음,5.0,0
2020.03.09,73846,aga**,깔끔한데 방에서 약간 냄새가 났어요 나머지는 다 좋아요,4.8,0
2020.02.29,73846,sbj**,"프론트, 린넨 직원분들이 너무 친절하세요. 실내 공간도 넓고 쾌적했습니다.",5.0,0
2020.02.26,73846,lyw**,깨끗하고 위치도 모두 만족스러웠는데 냉장고가 너무 안 시원했던 점이 아쉽습니다,5.0,0
2020.02.26,73846,ten**,침구가 진짜 너무 푹신하고 뷰도 좋아서 좋은 시간 되었습니다,5.0,0
2020.01.14,73846,que**,24시간스테이였는데 깨끗한 방에서 푹쉬다가 갔습니다ㅎㅎㅎ,5.0,0
2019.12.25,73846,cat**,세명으로 예약했는데 침대도 마음에 들고 이불도 마음에 들었어욤 ㅋㅋ,5.0,0
2019.12.15,73846,hav**,엘레베이터 기다리는 시간이 길었지만 그 외엔 다 좋았어요,4.5,0
2019.09.08,73846,gun**,"깨끗하고 나쁠 건 없었지만..
그렇다고 특별히 좋은 것 같지도 않았습니다.",4.5,0
2019.08.26,73846,hhw**,침구도 깨끗하고 위치도 좋고 선정릉이 보이는 뷰도 좋았어요,4.8,0
2019.08.18,73846,kkk**,침구가 좋아서 꿀잠잤어용 런치도 좋았고 전반적으로 모두 만족입니다^^,5.0,0
2019.08.15,73846,win**,"26층이었는데 뷰도 너무 좋고, 침구도 푹신하고 깨끗해서 좋았어요",5.0,0
2019.08.09,73846,jsb**,차가 없어도 접근성이 좋고 런치 부페도 너무 좋았습니다~,5.0,0
2019.07.30,73846,hae**,호캉스 좋았어요~! 화장실 문 나뭇가지 튀어나온거 손다칠수도 있으니 수리부탁드려요ㅎㅎ,4.5,0
2019.07.29,73846,bbt**,너무 깨끗하고 체크아웃 3시에 할 수 있어서 너무 좋았어요 ~_~ ㅎㅎ,5.0,0
2019.07.16,73846,jm5**,"다른 모든 것은 만족 넘어 훌륭했는데,
주차 진출입의 불편함이 좀 아쉬웠습니다",4.5,0
2019.07.16,73846,ant**,침구도 깨끗하고 조용한 위치로 주셔서 잘 쉬다왔습니다.,4.8,0
2019.06.20,73846,jhs**,"방도 깔끔하고 뷰도 좋았고
엄청 잘 쉬고 출근했습니다^^",5.0,0
2019.06.01,73846,asj**,침구가 너무 편하고 푹신해서 잘 잤어요~ 호텔 내에 있는 풋스파도 좋았습니당,5.0,0
2019.04.08,73846,min**,깨끗하고 야경뷰도 좋고.. 자주 애용하는데 항상 만족하고 있어요 ,4.8,0
2019.03.21,73846,daf**,주차장 입구가 좀 혐소하고 층마다 주차 공간이 많지 않다는 점 이외에는 만족스러웠습니다.,5.0,0
2019.03.07,73846,sdf**,"깨끗하고 좋았어요.
늦은 체크아웃을 미리 신청해서 푹쉬다 올수 있었어요.",5.0,0
2019.02.03,73846,sor**,깨끗하고 침구 푹신하고 좋습니다 선릉 뷰도 좋아요 또 갈 것 같아요,5.0,0
2019.01.27,73846,mei**,레이트체크아웃에 런치가 패키지로 되어있어서 호캉스 제대로 즐기다 갑니다,5.0,0
2019.01.21,73846,kim**,"침구도 깨끗하고 전체적으로 깨끗했어요!
다만 뷰가 낮은층이라서 조금 아쉬웠습니다",4.8,0
2019.01.20,73846,sfs**,"아이들과서울나들이
키자니아도가깝고롯데월드도가깝고

지하편의점까지

깔끔하고
귯귯귯",5.0,0
2019.01.14,73846,bnj**,방안이 다소 건조한 전 제외하면 가성비면에서 늘 만족스럽네요,5.0,0
2018.12.22,73846,jwj**,"침구깨끗
주차 늦으면불편
객실내 생수는...좀커졌으면..",4.8,0
2018.12.09,73846,l--**,가격대비 너무 좋고 위치도 좋았어요 만족해요 또 갈 것 같아요,5.0,0
2018.12.02,73846,gyw**,2주에한번 서울 가는데 꼭 여기서만 잡니다 가성비 최고,5.0,0
2018.11.20,73846,ggo**,"역시 좋은곳은 이유가있죠
매주 서울비지니스 호텔 다니는데 
다릅니다 굳",5.0,0
2018.11.06,73846,roc**,매우 깔끔하고 룸도 무료업그레이드 해주시고 아주 좋았습니다~~,5.0,0
2018.09.30,73846,hye**,서비스 모두 만족하고 편하게 쉴 수 있어서 즐거운 주말을 보낼 수 있었습니다.,5.0,0
2018.09.25,73846,wsa**,직원들 너무 친절하시고 방도 깨끗하고 특히 침대가 너무 편안해서 잘쉬다 갑니다 ,5.0,0
2018.09.23,73846,ant**,시설도 좋고 직원분들도 친절했는데 휴지통이 덜 비워져서 조금 아쉬움이 남네요,4.5,0
2018.09.02,73846,jia**,방음도 잘되고 접근성도 좋고 직원들도 친절해서 좋아요~~,5.0,0
2018.09.02,73846,kia**,"전반적으로 시설이 깨끗하고 좋았고 직원분들도 친절했음 
다소 주차문제가 불편했음",5.0,0
2018.09.01,73846,bnj**,침구가 편안해서 딥슬립했습니다. 샤워기 수압은 다소 아쉬웠네요.,5.0,0
2018.08.28,73846,ric**,"위치가 편하고 친절한 직원들, 객실이 깨끗했어요. 강추입니다^^~~",5.0,0
2018.08.21,73846,yue**,침대가 너무 편해서 좋았어요~ 잠이 솔솔! 힐링하고 갑니다아~ 아 맥쥬 어메니티 굿굿!!,5.0,0
2018.08.20,73846,bak**,"전체적인 시설도 깔끔하고 좋았어요 
특히 침구류가 너무 푹신해서 좋았어요",4.5,0
2018.08.20,73846,min**,화장실두넓구 거울도커서 너무 깨끗해서 좋았어요 보안두 철저하구요 ㅎ,4.8,0
2018.08.15,73846,ser**,"침구 인정합니다.. 정말 꿀잠잣어요~
층도 뷰도 너무맘에들었고 서비스도 매우만족!!",4.8,0
2018.08.14,73846,coo**,침구도 너무 푹신하고 방도 깨끗했어요. 뷰도 좋았구요 다음에 다시 또 올게요,5.0,0
2018.08.12,73846,lad**,방도 깨끗하고 직원분들도 다 친절하셔서 잘지내고왔어요~!,5.0,0
2018.08.11,73846,fut**,"룸 컨디션 좋고 전망도 좋았어요. 
직원들도 친절하고 좋았습니당. 지인들한테도 추천했어요",5.0,0
2018.08.10,73846,yes**,위치도 좋고 객실 내부도 깨끗하고 직원분들도 친절해서 좋았어요,5.0,0
2018.08.05,73846,ool**,"지하철역과도 가깝고 주변상권도 좋고~
재방문의사 100프로입니다",5.0,0
2018.07.16,73846,yoo**,까ㄹ끔하고 너무 좋아요 정말  최고!!!! 또 이용할거에요,5.0,0
2018.07.03,73846,art**,주차장이 너무 좁은것 빼고는 다 좋았네요 직원분들도 친절하시고요 잘 쉬다 갑니다,4.8,0
2018.06.20,73846,jms**,침구류도좋고 직원들 친절하고~ 주차장은 내려가는길좁아요,5.0,0
2018.06.15,73846,mim**,서비스도 좋고 방도 너무 세련되고 깨끗했어요. 높은층으로 가면 전망도 좋을 거예요.,5.0,0
2018.04.30,73846,bla**,깨끗하고 좋았는데 샴푸없이 컨디셔너만 두 개 있어서 당황했어요,5.0,0
2018.04.14,73846,ek1**,룸이 생각보다작고 테이블이 없어 조금 불편 나머지 시설은 만족해요,4.8,0
2018.04.10,73846,sta**,방이 살짝 추웠던 것 빼면 흠잡을데 없이 만족스러웠습니다,4.8,0
2018.03.27,73846,one**,주차장 진출입 통로가 심하게 좁습니다. 너무 불편해서 다음 예약이 꺼려질 정도 입니다.,4.8,0
2018.03.22,73846,dsk**,방 청결 문제를 제기하니 방 교체등 적극적으로 개선 하려는 노력이 좋음,4.8,0
2018.03.22,73846,mjc**,"침구가 넘 편했고, 전체적으로 시설깔끔, 직원 친절...또 오고싶어요.",5.0,0
2018.03.11,73846,taz**,"장점 위치 시설 깨끗함
단점 주차장 진출입로가 좁고 불편함",5.0,0
2018.03.11,73846,why**,"침구류도 아주 만족스럽고 전망도 좋아요~
디너 뷔페도 아주 만족스럽습니다",5.0,0
2018.03.03,73846,wis**,카드발급기가 고장나는 상황이 있었지만 직원분의 친절함때문에 편안한 하루 보내구 왔습니다,4.8,0
2018.02.18,73846,ont**,"ㅎㅎ깔끔하고 어메니티 좋앗어요
하지만 접근성이 의외로 취약 ㅠㅠ
도로변이라 부담쓰",4.8,0
2018.02.05,73846,xo_**,이불속에서 생뚱맞게 어메니티 샴푸가 나온거 빼곤 갠츈 ㅎㅎ,5.0,0
2018.01.12,73846,jae**,이쁘고 깨끗하고 좋았습니다.    밖에 출입문 직원분이 너무 추워 보였습니다.,5.0,0
2018.01.04,73846,ipa**,위치 좋고 새호텔이라 깨끗하고 다이닝 세미뷔페도 훌륭했습니다,5.0,0
2018.01.02,73846,you**,너무 좋은데 먼지가 너무 많았어요 ㅜㅜ 그거빼곤 정말 굳굳!!!!,5.0,0
2018.01.02,73846,byu**,"침대크기는 작았지만 둘이서자기에 충분했고,  푹신해서좋았습니다~",4.8,0
2017.12.27,73846,kkj**,시설도 좋고 깨끗하긴 하지만 엘리베이터가 불편합니다..,5.0,0
2017.12.25,73846,2ni**,침구도 폭신하고 접근성 대대대 만족입니다 조식도 맛있었습니다!!!,5.0,0
2017.12.25,73846,act**,"직원분들이 너무 친절했어요~ 
체크아웃시 엘리베이터 기다리기가 너무 힘들었네요~^^",5.0,0
2023.06.08,73846,tar**,샤워기 수압이 좀 약하네요…,4.3,0
2022.12.15,73846,kek**,침구류 카펫 먼지가 너무 많고 온풍기 때문에 많이 건조하고 춥습니다.,4.3,0
2022.05.12,73846,pjk**,항상 이용하는곳 직원들이 친절하고 객실 또한 깨끗해요.,4.3,0
2022.03.27,73846,val**,방음이 너무 안좋아요---- 옆방에서 하는 소리 다들리고 해서 그나마 직원들이 방 바꿔줘서 다행이지..,3.3,0
2022.02.21,73846,out**,친척 결혼식이 감남에 있어 하루 전날 일찍와 투숙했는데 깨끗하고 좋았어요,4.3,0
2022.02.05,73846,aka**,"주차장이 최악 입니다.
차를 가저가신다면 다른 호텔 이용을 추천드립니다.",4.0,0
2022.01.11,73846,eun**,주변에 편의점이 좀 걸어가야 있는점.. 그리고 너무 추워요 방이...,4.0,0
2021.10.29,73846,bij**,"위치좋고 편안해요 
다음에 또 이근처에서 일있으면 여기로 할꺼같아요!!!",4.0,0
2021.04.15,73846,wjs**,"주말엔 방음이 완벽하지 않아 좀 불편하지만

평일에는 사람이 별로 없어 괜찮습니다.",4.0,0
2021.03.22,73846,mae**,자주 애용하는곳인데 이번방은 이전 사용에 대한 청소가 미흡했는지 먼지가 좀있었네요,4.0,0
2021.03.14,73846,chl**,에ㄹ리베이터 바로 앞호실에 침구가 좀 지저분했어요 다른부분들이 너무 좋았는데 좀 아쉬웠어요,3.3,0
2021.03.05,73846,msr**,"좋아요~~! 시설및 위치 좋아요.
조식도 나쁘지 않아요",4.3,0
2021.03.01,73846,na1**,어제 급하게 가서 아무것도 준비를 못했는데 ㅠㅠ 호텔에 당연히 있어야하는 것들이 많이 없더라구요 ...,3.3,0
2021.02.28,73846,eta**,편하게 잘 이용했습니다. 넷플릭스 이용 가능해서 좋았어요,4.0,0
2021.02.12,73846,wjs**,"옆방에서 간헐적으로 쿵쿵 거리는게 좀 싫었지만

그래도 잔반적으로 젛았습니다.",4.0,0
2021.01.02,73846,hji**,"깨끗하고 접근성은 좋은데, 방이 좀 좁고 의자도 하나뿐이어서 아쉬웟어요.",4.0,0
2020.11.12,73846,son**,만족해엽. 추천. 단풍잎 흩트러지는 영상은 볼때마다 어지러워요. 그것만 빼고 만족,4.3,0
2020.11.11,73846,car**,다좋았어요.. 약간 더웠는데. 온도 조절 잘하시면 될듯요,4.0,0
2020.11.07,73846,das**,늘 잘쉬고가요~~ 포크가 필요했는데 일회용찾아서 가져다주시고 넘 감사해요^^,4.3,0
2020.11.03,73846,pyo**,치ㅁ구가 너무 따뜻 포근 좋았어요 뷰도 햇살이 잘 들어서 좋았급니다,4.0,0
2020.10.26,73846,yoo**,"사진과 같이 깔끔하고 좋았어요 접근성도 좋구요
다만 먼지가 좀 많았어요",4.3,0
2020.09.23,73846,zza**,"생각보다 방이 적었어요. 
옆건물이 사무실이라 계속 커튼을 쳐야했어요.
또 묵을것 같진 않네요.",3.3,0
2020.07.02,73846,swv**,전반적으로 만족했으나 드라이기 플러그가 망가져있었어요.ㅜ,4.3,0
2020.06.25,73846,yun**,"이ㄹ단 접근성은 진짜 최고구 ㅎㅎ
룸컨디션도 생각보다 넘 좋앗어요",4.3,0
2020.06.24,73846,yah**,"비지니스 호텔(신*스*이,글*드 등) 중에서는 제일 조음",4.3,0
2020.05.27,73846,gog**,호ㅏ장실벽에 이상한 핑크? 레드 자국이 찜찜하긴했아요. 나머지는 좋았습니다.,4.3,0
2020.05.22,73846,soo**,"전체적으로 쾌적한 숙소였습니다 
침대가 푹신했고, 깔끔해서 만족스러웠습니다 ",4.3,0
2020.05.20,73846,hip**,접근성 좋구‥ 객실에서 보는 가든뷰 전망이 참 좋았습니다‥재방문 의사 있습니다‥,4.3,0
2020.05.15,73846,dj9**, 침구가 아주 따듯했어요~~~ 조금 좁아서 답답한 느낌이있지만 잠은 아주 잘잤어요 커피도 짱맛있어요!^^,3.3,0
2020.05.10,73846,bbb**,적당한 크기여서 좋았어요! 객실 층수가 높아서 도시 뷰를 볼 수 있어서 좋았어요!,4.0,0
2020.04.26,73846,nhk**,"시트에서 약품냄새 심하게 났어요 
그부분 좀 개선해야할듯 하네요",4.0,0
2020.03.21,73846,tls**,다 좋았는데 생각보다 방이 조금 좁아서 불편했어요 이것만 빼면 다 좋았습니다~,4.0,0
2020.02.10,73846,gga**,방음은 좀 아쉬웠지만 객실 서비스와 친절함에 즐거운 여행이였습니다.,4.0,0
2019.12.18,73846,son**,"좋았어요 다만 조식때 밥이 없어요 이랬더니 표정이 ~~
다른거 다 괜찮았어요",4.0,0
2019.10.25,73846,tea**,"가격대비 훌륭한 시설과 조식덕분에 편히
쉴 수 있었습니다. ",4.3,0
2019.08.18,73846,ljh**,위치도 좋고 방도 깨끗해서 잘잤어요! 선정릉뷰 룸이었는데 남산타워도 보이고 좋았어요~~,4.3,0
2019.05.25,73846,wls**,엘레베이터가 비효율적으로 15층에서 9층까지 내려가는데 층마다 다 서서 10분 소요됐어요,4.3,0
2019.02.04,73846,a74**,"깨끗하고 인테리어도 좋고 가격 대비 괜찮았습니다
뷔페는 좀 기대 이하였어요",4.3,0
2018.12.09,73846,fly**,"방도 깨끗하고,직원들도 친절합니다.다만 조식이 가격 대비 좀 떨어집니다.",4.0,0
2018.10.12,73846,han**,너무 좋았는데 주차장 내려가는 길이 너무 좊아서 많이 긁었어요 ㅠㅠㅠ ,4.0,0
2018.08.21,73846,pol**,다 좋았어요 하지만 주차장내려가는게 너무힘듦 운전못하면100프로 휠 타이어 긁힘,4.0,0
2018.07.18,73846,cha**,도심에 있고 접근성도 좋고 주차장이 작아서 불편했지만 전체적으로 만족이예요,4.0,0
2018.04.28,73846,wod**,"주차장이 비좁은 것 빼고는
깨긋헌 시설과 편리한 접근성 모두 만족스러웠습니다",4.0,0
2018.04.23,73846,luc**,"체크인 셀프시스템, 물이 사이즈가 작은것 빼고 다 괜찮았어요 무엇보다 쾌적해서 좋았습니다",4.0,0
2018.04.15,73846,iru**,객실도 깨끗하고 직원분들도 친절하셔서 너무 감사했어요 지하철이 가까운것도 좋았어요,4.3,0
2018.04.07,73846,cjs**,이벤트 있다고 했는데... 전 안챙겨주고 다른팀은 챙겨줘 약간 억울...,4.0,0
2018.03.19,73846,luc**,침구가 푹신하고 깨끗해서 좋았고  셀프체크인아웃하니 편리했어요,4.3,0
2018.02.15,73846,hji**,프론트가 널널할때도 굳이 키오스크로 체크인/아웃 할 필요가 있을까요?,4.0,0
2018.02.15,73846,630**,지하주차장연결이 불편 8층 까지 오피스란 안내가 부족함,4.0,0
2017.12.25,73846,nal**,다른건 좋은데 공기에 먼지가 너무 많았습니다. 환기가 제대로 되는건지 모르겠네요.,4.3,0
2021.10.23,73846,did**,"온라인 체크인아웃 시스템이
편리했어요~접근성이좋고 깨끗해서
애용하는곳입니다.",3.8,0
2021.08.02,73846,eun**,깔끔하고 다른 호텔보다 체크인할때 기다리는시간없이 빠르게처리되어  만족합니다~,3.8,0
2021.03.19,73846,gyu**,"가격만큼 인곳
투배드는 침대가 넘 작긴한데... 뭐 싸니까
",3.5,0
2021.03.07,73846,cik**,전반적으로 만족스럽습니다. 간이용 테이블이 없어 간단한 다과를 먹기에 불편했습니다.,3.8,0
2021.01.15,73846,jia**,"객실에 휴지가 부족했구요,청소상태가 깔끔하지 않았어요. 위치는 정말 좋았네요.",3.8,0
2020.11.06,73846,lka**,그냥 평범했어요. 그런데 바디워시를 교체안해주셨더라구요 ㅠㅠ,3.5,0
2020.09.20,73846,n64**,지하주차장 내려가는 길이 너무 좁아서 힘들었네요. 수압은 왜 그리 약한지...객실 컨디션도 모텔 수준이고. 쵝악이네요.,2.3,0
2020.04.08,73846,gun**, 다 좋았지만 조금 아쉬웠던 점은 가든뷰를 선택했는데  시티뷰로 주셔서 그게 좀 걸렸습니다,3.8,0
2020.03.17,73846,ben**,처음입실할때 화장실 하수구냄새가 진동하는거 빼곤 좋았습니다,3.5,0
2019.02.07,73846,bok**,전체적으로 깔끔하고 좋았지만  욕실에서 조금 찌린내가나서 그것 말곤 전체적으로 괜찮았어용,3.5,0
2019.01.20,73846,go0**,대체로 청결하고 좋았지만 방음이 안돼서 좀 시끄러웠습니다.,3.5,0
2018.08.17,73846,zax**,"전반적으로 나쁘지 않았다.
욕조가 없는 것과 엘리베이터 순환이 너무 안 되서 짜증났다. ",3.5,0
