reviewAt,code,nickname,comment,avgScore,helpfulCount
2023.08.16,73846,rud**,"수압이....짧은머리도 쉽지 않을정도로 엄청 약해요..
이 정도 퀄리티의 호텔에서 이래도 되나 싶을정도로 약해요...수압 제외 모든면에서 100프로 만족이지만 수압때문에 30프로 만족이라고 할 정도 입니다..
개선할 필요가 있어요!!!!!!",5.0,1
2023.07.24,73846,esc**,일단 방도 청결하고 시설도 깔끔하고 관리가 잘되어 있습니다! 주차들어가는 입구가 좀 좁아서 큰차는 들어가기 힘들 수도 있겠더라구요~ 고층은 엘리베이터가 좀 늦게 올라와서 조금 불편했지만 나머지는 전체적으로 만족했습니다!,5.0,1
2023.08.03,73846,sk1**,편안한 잠자리 였어요. 다만 엘리베이터가 층수가 보이지 않아 답답. 인근 공사로 조금 시끄러운점. 또 13층이지만 맞은편 사무실이 가깝게 느껴져 문을 열지 못한점이 불편했어요. 서울여행이 목적이라 잠만자고 나와서 많이는 불편하지 않아서 잘 쉬가 갑니다.,3.8,0
2023.07.28,73846,gho**,"침구 깨끗, 아늑하고 깔끔한 분위기, 푹잘잠, 모바일체크인/체크아웃 가능, 접근성 높음. 선정릉뷰 낮에만 이쁘고 밤에는 아무것도 안보임. 암막커튼 좋음.",4.5,1
2023.03.07,73846,ys4**,"선릉역에서 가까워 접근성 아주 좋았고 침구상태도 깨끗하고 공기청정기가 있는 것도 좋았어요.
전반적으로 만족했는데 샤워실 바닥이 평평하다 보니 물빠지는 게 느려서 그게 살짝 불편했고 엘리베이터가 블랙계통이라 어둡기까지 해서 좀 무서웠어요.",4.8,2
2023.01.12,73846,sos**,"아 네 뭐 더 말할것도 없이 아주 만족했네요. 
특히 객실을 11000원 주고 업그레이드 한게,
아주 신의 한 수 였달까요,.?

아 그리고 야간에 계시던 여직원 분께는 또 한번,감사 드립니다 .

저희가 🏪 에서 귀찮은 음식들을 사와서 렌지가 필요했는데요 귀찮은 내색하나 없이 그대로 다 직접 뜯어서 돌려주시기 까지..ㅠㅠ

그나저나 앞으론 이날을 잊을 수 없는 개인적인 일이 하나 있었는데요 

불쌍한 우리 엄마..
좀 살려주세요 ㅠㅠ
새벽에 동생 전화받고 얼마나 ..
많이 슬플거 같아요 정말 ㅜ
아직까지 제대로 된 자식노릇은 커녕
화해조차 제대로 못했는데..
 
아 정말 죄송합니다. 이런 곳에다 이런 이야기 써대서 ㅠㅜ
하지만 왠지 쓰고 싶었던 이유는 이날 겪었던 좋은 기운이 부디 대구까지 이어지기를 바래서입니다.",4.5,3
2022.10.04,73846,nra**,"방이 깨끗하고 좋았어요. 시티뷰였는데, 뷰는 크게 기대는 않는게 좋습니다. 선릉역 가까이에 위치해 있어서 접근성도 좋고, 직원분들도 친절했습니다:)
풋스파와 피트니스 시설도 이용했는데 깔끔하고 좋았어요.",4.8,2
2022.10.03,73846,ykj**,생각한 것보다 넓직하고 쾌적해서 좋았어요. 명동점보다 쪼끔 더 여유있는 듯한 느낌? 랜덤배정상품으로 샀는데 더블 되냐고 물었더니 더블로 배정해주셔서 감사했어요. hdmi가 안 돼서 직원분 불렀는데 고쳐주셔서 넷플릭스도 잘 이용할 수 있었어요. 역에서도 가깝고 주변에 먹을 것도 많고~ 데이유즈 잘했습니다.,4.5,2
2022.09.14,73846,cha**,"서울에서 선정릉을 사장 잘 볼 수 있는 호텔이 아닐까 싶습니다. 선정릉 반대편에 위치한 비슷한 가격대 동급의 아코르 크레센도 호텔에서 전날 하루 묵었는데 보다 전망과 객실 넓이 컨디션에서 모두 L7이 좋았어요. 
2호선 선릉역에서 도보로 방문 가능하고 역시 도보거리에 선정릉이 있어 둘러보기도 좋습니다. 선정릉은 매주 월요일 휴장이니 참고하시고 방문하시면 좋을것 같아요. 

칫솔 치약은 따로 제공이 안되니 챙겨가시거나 지하 1층 세븐일레븐에서 구매하세요!",5.0,4
2022.05.28,73846,shi**,"서비스가 너무 친절해서 와인잔, 와인 오프너, 휴대폰 충전기를 다 받아서 편하게 쓸 수 있었어요🙃 룸 컨디션도 정말 좋아서 평소에는 잠 잘 못 자는 편인데 친구랑 모두 꿀잠 자고 왔습니다🌿✨ 재방문 의사 가득 !!!",5.0,1
2022.03.27,73846,cpa**,"두번째 방문인데, 직원은 변함없이 친절하고, 침구상태 괜찮았고, 조용했어요. 방음이 좋은 편은 아니예요. 옆방에서 그소리가 들려와서 조금 민망했어요. 그래도  그때빼고는 조용했어요. 만족합니다.",5.0,3
2022.03.19,73846,jiy**,"체크인시 받은 방키가 작동이 되지 않아 
다시 데스크로 다녀왔습니다
엘리베이터는 한 번 타려면 엄청 기다려야 하구요.
죄송하다고 체크아웃 한 시간 늘려주셨는데, 다음날 체크아웃 연장하시겠냐며 전화가 왔네요
꼼꼼히 확인 해주시면 좋을 거 같습니다.

나머지는 대체적으로 만족이에요",4.8,1
2022.02.26,73846,149**,"처음 방문했는데.. 일단 직원분들이 다 너무 친절하시네요~ 1층 안내 해주시는 직원분도 그렇고 프론트 직원분들도요~ 전체적인 시설이나 청소 상태 도 만족스러웠습니다. 
다만 냉장고가 조금 작은점? 그리고 화장실 문이 미닫이인데, 문과 벽 사이에 틈이 있어 같이 있으면 소리에 조금 신경 쓰일듯해요 ㅎㅎ
선릉역과도 가깝고 넷플릭스도 이용 가능해서 더 좋았습니다!^^
직원분들 친절히 대해주셔서 좋았어요~ 감사해요♡
또 방문하고 싶네요~^^",4.8,2
2022.02.16,73846,bvl**,"몇번 가봤지만 근처 비슷한레벨의 비즈니스호텔중에는 가장낫다고봅니다
다만 주차장 진출입로가 아주많이좁고 주차공간이 협소하여 주의가 필요해요
중형차 이상이면 많이 불편할겁니다

직원분들도 친절하고 각 시설,비품도 깨끗했으며 고층의 선정릉뷰도 좋았습니다",5.0,3
2022.01.21,73846,bob**,"침구가 깨끗하고 작은 베개도 있어서 너무 좋았습니다. 목이 안좋아서 평소에 베개를 낮은걸 쓰다보니 높은 베개만 있으면 불편했는데 낮은것도 구비해놓아서 너무 좋았습니다.
룸 내부도 깔끔하고 상당히 좋았습니다. 그리고 하우스맨이 너무 친절하게 부탁드린 일을 해주셔서 감동이었습니다.
다음에 기회가 되면 또 들르겠습니다.",5.0,5
2022.01.15,73846,tna**,"타지에서 올라와 아들 병원갈때 마다 ㅡ 이용하는 호텔이네요
너무너무 반갑게 맞이해주시고, 업글도 해주시고 아이병원 왔다는 말씀에 조용한 룸으로 해주셨어요~그리고 편안하게 주무시라고, 아이음료랑맥주 과자 선물까지 ^^처음으로 조식을 이용해봤는데 ㅡ많은 종류는 없었지만.  그래도 음식이 다 입맛에 맞았고,이정도면 아침 든든하게 먹고 덕분에 시간 절약하며병원갈수 있었네요 
8월에 또 방문 할께요 감사합니다 
덕분에 아들이랑 편안하게 쉬다 갑니다",5.0,1
2022.01.09,73846,bor**,"체크인할 때 업그레이드 해주셔서 더 넓은 룸에서 지낼 수 있었어요. 늘 주차빼고는 모든 것이 완벽해요. 가성비 갑 호텔이랄까..? 
룸이 깨끗하고, 침구도 넘 편안하고, 샤워기 수압도 높고, 어메니티 특히 바디로션 레몬 향이 너무 좋네요. 어메니티도 대용량 펌핑 방식이라 다른 호텔에 작은 아메니티 뚜껑 열었다 닫았다 하지 않아도 되사 정말 편해요! 
객실도 조용하구요!
아.. 한가지 아쉬운게 있다면 드라이기 바람이 너무 약해서 마리말리는데 15분 넘게 걸려요 ㅠㅠ",5.0,5
2022.01.05,73846,myd**,엘세븐 강남은 두 번째 방문이였는데 이번에도 잘 쉬다 가요!  칫솔 치약도 요즘 환경보호로 인해 없는 곳들이 많은데 여기는 준비되있어서 좋았고 가장 장점은 복도에 정수기가 따로 설치되있는게 좋은 것 같아요 가끔 물이 부족할 때도 있는데 정수기 별도 설치되있는게 정말 편리한 것 같습니다!,5.0,2
2021.12.19,73846,lov**,"어제 결혼식을 치르고 아내와 함께 L7에서 시간을 보냈습니다-! 저희가 오후 예식이었어서 레이트 체크인상품이 있었던 L7은 우리에게 제격이었습니당! 
지하주차장은 근데 좁긴했어요 ㅠㅠ 그래서 운전 못하시는분들은 불편할수도있음여..

체크인을 할때는 우리가 예약했던 객실이 공실이없어서 무료로 슈페리얼급으로 업그레이드가 되었는데 너무 결혼선물 축하받은 느낌 감사합니다 

객실도 너무 깨끗하규 조식도 맛있고 좋았어요 ㅎㅎ",5.0,1
2021.12.19,73846,bor**,"기본적으로 깨끗하고, 선릉역 바로 앞이라 접근성도 좋아요. 특히 직원분들이 엄청 친절해서 자주 이용해요. 엘베 안내 해주시는 분, 프론트데스크에 계신 분들 모두 엄청 친절하세요. 
저는 넘 피곤해서 날짜 연장하는데 방법도 자세히 알려주시고, 하루 연장하니까 청소랑 필요한 물품 있는지 확인도 일일이 다 해주시고.. 암튼 부대시설은 부족하더라도 청결과 서비스는 신라호텔 못지 않은 것 같아요!",5.0,2
2021.10.28,73846,ksy**,"침구가 깨끗했고
배달 음식 시켜먹었는네 수저 포크를 모르고 괜찮다고 체크하여 프론트에 전화 했는데 여성 직원분이 직원들 쓰시는 일회용 수저라더 괜찮냐며 챙겨주셔서 편의점 내려가지 않고 호딱 밥 먹어서 좋았어요 ㅎ
직장이 근처라 출근하는데 1분컷이라서 예약한건데
편하고 좋았습니다~
연박이였는데 첫날 넷플릭스 공유기가 문제 있어서 그것도 전화 드렸는데 빠르게 해결 되었고 
주변 공사중이라 소음 걱정 했는데 조용한 편이였어요
아 둘째날에는 화장실에서 하수구 냄새? 
같은게 나긴 했으나 전반적으로 좋았습니다~!",4.8,4
2021.09.02,73846,smi**,"두번째 방문인데 이제 시설이 새것 느낌은 없어졌어요;;  살짝 노후된 느낌 접근성 좋고 침대도 좋고 직원도 친절해서 할인한다면 재방문 의사 있어요
그나마 선릉쪽에선 제일 나은듯해요",4.5,2
2021.07.12,73846,wnd**,"저번 가족여행보다 방이 작은 싱글룸였는데 훨씬 룸상태가 좋았습니다:)
친구와 저 둘이서 너무 즐겁고 쾌적하게 쉬다갑니다. 잠도 푹신한 침구에서 넘 편히 잘잤구요^^ 친구는 서울에서 호캉스는 별 의미없게 생각했었는데 즐거웠다하네요 ㅎㅎ 홍보도했어요 추천추천. 자주올게요",5.0,2
2021.07.11,73846,ckh**,"이상한게 추워서 온도올려서 히터를 틀고 적당히 따뜻해서 온도조절기를 끄면 바로 찬바람이 나와요. 직원분 말로는 공기청정기능이라던데.

조용하고 침구도 편안하고 직원분들도 항상 친절하시고 쉬다가기 좋으네요. 화장실도 항상 깔끔하고요.",5.0,1
2021.07.10,73846,wnd**,접근성이나 시설. 직원분들의 응대 모두 기대이상이였습니다^^ 다만 청소면에서는 평소 예민한 부분도 있지만 시국이 시국이다보니 더 신경이 쓰일수밖에 없는 상황인데 침구에서 세탁세제류가 아닌 약간 중성적인 낯선 향이 느껴져 후각이 예민한 저는 눕는 순간순간 신경이쓰였어요. 그렇다고 침구를 갈아주지 않았다 생각하진 않습니다^^ 향에대한 개인 의견이고 나머지 카펫이나 테이블 등 약간의 부스러기나 화장실 컨디션의 미묘함은 금액대비와 예전과달리 호텔들도 배달음식 섭취가 가능해지면서 청소범위가 광대해졌으리라 생각에.. 어느정도는 가만했습니다. 하지만 무엇보다 청결에는 조금 더 신경을 써주셨으면 좋겠어요 ㅜㅜ,4.5,1
2021.07.06,73846,bae**,"룸이 깔끔하고 침구도 폭닥하니 좋았어요! 로비랑 라운지도 예쁘고 특히 일정 마치고 돌아와서 라운지에서 풋 스파 할 때 정말 행복했어요ㅜㅜ 뷰도 선릉 뷰가 진짜 최고,, 멀리 안 나가도 빌딩에서 벗어난 것 같아서 좋았어요!",5.0,1
2021.06.01,73846,ybr**,"직원분이 엄청엄청 친절하세요!
뷰 선택할수있게 물어봐주셔서 좋았어요
방컨디션은 딱히 신경안쓰는데 전에쓰던 사람이 떨어뜨리고 간 키카드가 바닥에있더라구요
꼼꼼히 청소하시는건 아니구나 생각했어요",4.8,4
2021.05.16,73846,zos**,"비가 와서 멋진 야경을 보진 못했지만 높은층에서만 볼수있는 특별한 시간을 가질수있어서 좋았습니다~조식도 메뉴가 다양했고 샐러드도 신선했고 모든 반찬들도 맛있었습니다!!
다만 조금 아쉬운건 층수가 높으면 엘리베이터 기다림이 조금 길어질수가있어요..몇층에 왔는지 알수가 없어서 조금 불편한건 있었어요",5.0,1
2021.05.02,73846,kmk**,"방도 넓은 편이고, 선정릉 보이는 파크뷰로 고를 수 있어서 너무 좋았어요! 직원분도 너무 친절하게 안내해주셨구 위치도 선릉, 삼성역 다 가까워서 편했어요. 근래 묵었던 호텔 중 제일 만족도가 높아서 다음에 또 가려구요!!",4.8,1
2021.04.22,73846,hyu**,"당일예약했는데 고층 뷰 예쁜곳으로 배정해주시고 친절하게 안내해주신 덕에 호캉스 마음 편히 할수있었어요:)호텔 시설 좋다는 얘기는 들었는데 기대한만큼 만족해서 다음에 호캉스하러 종종 오려구요!한가지 아쉬운점이있다면 화장실에서 담배냄새랑 꿉꿉한 냄새가 나더라구요, 다른 객실에서 누가 담배를 펴서 올라오는건지 모르겠지만,,화장실에서만 유독 냄새가 좀 심해서 그부분이 아쉬웠습니다!",4.8,2
2021.04.09,73846,soh**,너무너무 좋았어요 3명이서 올때는 L7이 진짜 좋아요 !!!!! 친절하고 깨끗해서 항상 또 오고싶어요 근데 베개가 머리 지탱을 잘 못해줘서ㅠㅠㅠㅠㅠ 고것만 아쉬워요 다른건 다 너무 좋았습니다!,5.0,2
2021.04.04,73846,yun**,"아무래도 신식이니 전체적으로 깔끔하고 다 좋았음
무엇보다 좋았던건 침구... ㅎㅎㅎ 
시그니엘도 가봤는데 비슷한너낌. 매트 푹신하고 침구류는 서걱거리고 좋았어요 

다만 주차와 엘리베이터는 좀 최악 ㅜㅠ
그리고 대로변쪽 객실 슈퍼카소리 장난아님 
비와서 그나마 덜했던듯요 ㅎㅎㅎ ㅎㅎㅎ

그래도 전반적으로 만족했음
다음번엔 접근성좋은만큼 워킹으로 방문하는게 날 것같아요 ㅎㅎㅎㅎ 글구 대로변쪽 객실말고 다른쪽으로 ",4.5,1
2021.01.23,73846,sec**,들어가서 체크인을하는데 남자직원분이 친절하게 잘 안내해주시고 고층으로 주셔서 기분좋게 방에들어갔습니다. 방은 컨디션은 대부분 상태좋았으나 바닥이카펫임에도 먼지가 좀 보여서 아쉬웠습니다ㅠㅠ 그외엔 소음도 없고 너무 맘에들었고 잘쉬었다가네요~,4.5,0
2020.12.19,73846,rhk**,선릉역에서 호텔까지 5분정도걸리고 삼성 코엑스에서 15분정도 걸립니당~~커다란간판같은게없어서 찾는데 조금 해맸습니다ㅠㅠ문에 L7이라고 작게쓰여있어서 더 헷갈릴뻔ㅠㅠ그래도 직원분들도 친절하셨고 룸컨디션도 나쁘지않았습니당~,4.8,0
2020.12.14,73846,don**,"전반적으로 침대시트랑 화장실이랑은 깨끗하긴 했는데.. 다른부분들은 다 깨끗한데 침대 틀 위에 먼지가 수북히 쌓여서 놀랐네요.. 일단 기본적으로 먼지가 너무 많아서 그냥 뒤척거리는거에도 쌓일 수 있다 생각합니다..

공기청정기가 방마다 있었으면 더 좋았을꺼 같네요 ㅎㅎ

그래도 사람이 할 수 있는 부분에서 전반적으로 깨끗하고 깔끔해서 만족스러웠습니다. 잘 묵다 갑니다.",4.5,0
2020.11.28,73846,xhs**,"무ㅓ 후기를 적으라면사 복사도 안되고 짜증나네요 어플이
근처 건강검진센터에서 오전일찓 검사헤야해사
신랑이랑 방을 각자 잡았는데
룸 상태도 좋고 깨끗하고 조용하네요.
늦게 체크인헤서 가든뷰가 없어서 아쉬웟지만
씨티뷰도 좋앗으뇨
담엔 조식먹으러 또 갈 예정입니다
",5.0,0
2020.11.09,73846,dlf**,"좋았어요 직원들이 매우 친절했고. l7은 제 기준 모텔급 호텔 치고 룸 컨디션도 괜찮았어요.위치 접근성이 아주 좋아서 서울에서 갈일 있으면 다음에 또 묵을것 같아요
가을에 가면 좋을것 같고.  가습기 요청하니 준비해주셨어요. 가습기에 공기청정 기능도 되어서 좋았어요.
단점은 로비가 9층인데 엘레베이터가 2개뿐이라 (총 3개지만 하나는 지하용) 다니기 너무 나빳어요..  룸서비스가 없어서 배달음식 시켜먹었는데 배달음식 받으러 나가는데 진짜 한나절 걸렸네요..",4.8,0
2020.09.28,73846,ode**,"베드가 폭신하고 침구도 깨끗해서 잘 잤어요~전체적인 룸 컨디션이 좋아허 마음에 들었구요~
수건이나 타올이 조금 뻣뻣하고 까슬거리는 재질이긴 했지만 전반적인 시설이 다 좋았고 무엇보다 컨시어지 분들이 굉장히 친절하고 정확하게 안내해주셔서 매우 만족스러웠습니다~~
다음에 또 방문하고 싶어요",4.8,1
2020.09.25,73846,sas**,직원분들이 너무 친절하시고 경치도 너무 좋앗습니당. 소음도 전혀 없고 경치 오지고  '여기 진짜 괜찮네'라는 말을 하며 12시까지 푹 잣어요 ㅎㅎㅎㅎ 비누향도 좋고. 좋은 숙박 감사해요,5.0,0
2020.08.09,73846,mwl**,"지금까지 많은 호텔을 다녀봤지만 가장 직원분들이 친절한곳 같아요. 체크인시 뷰, 층수, 등등 많은 부분을 먼저 고려해주셔서 좋았습니다. 접근성 매우 좋고, 전체적으로 깔끔하고 모던한 분위기였어요. 한여름 장마 시즌에 24시간 호캉스 패키지는 정말 좋은 마케팅인듯해요.",5.0,0
2020.07.28,73846,hsi**,"전체적으로 깔끔하고 이동이 편리한 곳 위치에 있어서 좋았다.
살짝 아쉬운 것은 환기가 제대로 안되는 것인지 침구류에서 발생되는 먼지가 불빛에 떠다니는 것이 보여 불쾌한 점 빼고는 좋았다.다음 기회에 다시 이용할 생각이 있다",4.5,0
2020.05.10,73846,whg**,"심한 비염이라 먼지가 많다해서 걱정했는데 한번도 비염이 올라오거나 하지 않았고 침구류, 수건 등이 정말 깨끗하고 보송보송했습니다 / 프론트 직원분께 전자레인지를 요청드렸는데 요청드린 시간 안에 음식이 데워지지않아 직원분께서 추가로 직접 다시 데워주신걸 알려주셨습니다 세심하고 친절한 서비스에 기분이 좋았습니다 / 투숙객이 적지 않은 것처럼 보였음에도 룸에서 요청드린 사항을 바로 해결해주셨습니다 ",5.0,1
2020.05.05,73846,aar**,"서ㄴ정릉 뷰로 숙박 했는데 정말 뷰가 너무 좋았어요~ 그리고 직원분들이 참 친절 했는데 특히 조식 먹으러 갈때 계시던 분들, 그리고 체크인 도와주시는 분들이 특별히 더 친절했어요. 이 레벨과 가격대의 호텔 중 가장 괜찮다는 생각이 들어요. ",5.0,0
2020.05.03,73846,jae**,침구가 무척 편안했고 공간이 생각보다 넓고  쾌적했습니다! 1인소파와 테이블도 매우 편안했고 무엇보다 접근성이 뛰어나서 코엑스에 쇼핑하러가기도 편했습니다. 유일한 단점은 티비화질이 떨어진다는 것과(몇몇 채널은 버퍼링 걸림) 엘리베이터 문이 굉장히 빨리 닫힌다는 점입니다. ,4.8,0
2020.05.02,73846,cgi**,가든뷰 미리 요청드렸는데 역시 너무 좋았어요. 시설의 디테일한 부분에서 센스가 느껴졌습니다. 다만 카펫과 침구에서 먼지가 좀 많고 객실이 건조한 편이었습니다. 나갔다가 들어갈때도 직원분이 온도 체크 꼼꼼히 해주시는거 보고 안심했습니다~ 좋은 하루 보내고 가요!,4.8,0
2020.04.29,73846,ji_**,"환기 + 침구 + 방음 +직원분들 친절도 중요시 여김

모두 맘에 들었음

방음은.. 딱 한번 말소리가 들리긴 했는데 윗층인지 아랫층인지 옆방인진 모르겠음 
말고 선릉역에 위치해있으면서도 전혀 시끄럽지 않고 아주 조용하게 쉼. 선정릉 뷰 18층으로 묵었는데
아주아주 만족스러운 3일이었음. 담엔 더 고층으로 묵어보고픔 전망이 기대되어서.

특히 가습기+공청기 투인원이라 넘좋았음 어디 제품인지 볼걸....ㅠㅠ 담에 가서 봐야지 구매하고싶을정도임.

침구도 아주 편안하고 특히 베개가 굿굿",5.0,1
2020.04.12,73846,jus**,"프론트 직원 분들이 다 친절하셔서 좋았습니다. 객실 청소 상태도 좋았고 체크인 할 때 파크뷰로 요청했는데 반영해준 것도 좋았어요~
다만 침구에 먼지가 많아서 그게 좀 아쉬웠습니다.",5.0,0
2020.04.12,73846,ozn**,"코로나 때문에 1층에서 매번 들어갈때 온도 체크해주시고,  체크인할때도 이마부분 온도를 재서 안심이 되었어요. 
침구가 정말 포근해서 잠을 푹 잘수 있었고, 방에 창을 열수 있어서 환기가 되는 것도 무척 마음에 들었습니다! 깨끗하고 접근성 좋고 다음에도 이용할 것 같아요!! 강력추천합니다.",5.0,0
2020.04.07,73846,als**,베드가 진짜 편해요!! 레이트 체크아웃 프로모션 좋은 것 같아요 ~ 휴식하기 정말 좋고 편히 쉬다 왔어요. 저는 늦게 체크인을 해서 뷰는 별로 상관하지 않았는데 선정릉 쪽 뷰도 궁금하긴 하네요! 도심이라 주변에 뭐 다 있어서 편리했고 객실 층이 높아서 좋았어요 !!! ,4.8,0
2020.02.27,73846,tan**,"다 좋았는데 욕실 청소상태가 조금 별로.
왜 그런가 했는데 샤워하면서 보니 수압이 너무 약해.
바쁜 출장길에는 불편할듯.
욕실 출입문도 슬라이드 도어인데 방음 안됨.
나홀로 호캉스라 다행이었음.",5.0,0
2020.01.27,73846,sni**,"직원들은 친절했습니다. 하지만 식사 포함된 예약이었는데, 예약을 미리 했어야한다는 공지 없이. 예약이 이미 꽉차있어서 식사가 늦어졌습니다 미리 공지가 되었으면 좋겠네요. 나머지 부분들은 다 좋았습니다.",4.8,0
2019.12.15,73846,gol**,"l7호텔 두번째 방문입니다. 레이트체크아웃이 옵션으로 포함되어있는 스탠다드 더블룸에서 하루를 보냈는데 새벽간 외부소음, 방 사이의 소음은 전혀 느끼지 못했습니다. 위치 좋은거는 사실 언급할 필요없이 훌륭하며 l7의 로컬리티를 중요시하는 브랜딩 덕인지 강남에 어울리는 세련됨을 느낄 수 있어서 좋았습니다:) 별 탈 없이 잘 있다 갑니다^^",5.0,1
2019.08.18,73846,sou**,룸컨디션이 좋았고 쾌적했습니다. 화장실도 비즈니스호텔 스탠다드 룸치고 넓은 편이었어요. 고층 선릉뷰여서 창반 봐도 너무 좋았어요. 플로팅에서 먹은 점심도 만족스러웠구요. 다만 좀 아쉬운건 수건들 중에 깨끗하지 않은 것들이 있다는거예요. 뭐가 뭍은 것 마냥 얼룩진것들이 있었어요... 그것 외에는 다 좋았어요.,4.8,0
2019.08.16,73846,ugp**,레이트 체크아웃했는데 그게 정말 좋았어요ㅠㅠㅠ 1박 2일이었지만 오랜만에 늦잠도 자고 여유를 느끼며 색다르게 데이트하니 정말 좋았네요!! 런치도 매우 만족했고 직원분들도 넘 친절하셨습니다 감사합니다!!,4.5,1
2019.08.07,73846,k09**,"서울 출장 한달에 10일정도 가는데 지금까지 가본곳중 최고인듯
주차장 협소하다고 해서 걱정했는데 초보자 아니라면 큰문제없을듯하고 엘베를 잘못타면 헷갈림
근데 1층로비직원이 친절하게 안내해줘서 큰어려움은 없을듯
객실뷰가 환상임 선릉이 그렇게 멋진곳인줄 첨알았음",5.0,0
2019.06.23,73846,ast**,접근성도 좋고 런치도 맛있고 모든것이 만족스러웠네요. 특히 데일리호텔pkg 덕분에 다양한 혜택을 즐길수 있었네요. 참고로 풋스파는 기대할만한 곳은 아니였지만 그것이 주가 아니기에 참고만 하세요,5.0,0
2019.05.31,73846,d5l**,직원들의 손님과 대화하는 방법이 매우 인상적입니다. 여러가지 어려운 상황을 본인이 끝까지 들어서 해결을 하려고 노력하는 꼼꼼한 서비스가 있어요. 이는 Forbes 5 star 호텔에서도 쉽게 찾아보기 힘든 모습입니다. 저는 특히나 체크인 시 다정하게 안내를 해주시고 호텔 패키지를 잘 설명해주시고 챙겨주시는 모습에 감동 받았어요. 트레이닝 명판을 하고 있는 직원이었습니다.  다른 직원들도 체크아웃시에도 다양한 손님들과 여러가지 이야기를 하며 문제 해결을 하는 것을 보게 되었는데 지혜롭게 잘 이야기하고 해결하는 것을 보고 대단하다고 생각했습니다.  교육이나 시스템이  매우 체계적이고 좋은 문화를 가지고 있는 호텔입니다.,5.0,0
